Title,Channel,Duration,URL
"Meta Ray-Ban Display hands-on: best smart glasses I’ve ever tried","The Verge",7m 36s,https://www.youtube.com/watch?v=5cVGKvl7Oek
"Rainbow Clad Trans Activists Won't Stop Yelling Nonsense at Me","Charlie Kirk",14m 53s,https://www.youtube.com/watch?v=iGIc8ygpHKw&pp=ugUHEgVlbi1VUw%3D%3D
"Meta Connect 2025: Everything Revealed in 12 Minutes","VRelity",12m 28s,https://www.youtube.com/watch?v=N2HQhTbZUdY
"ОДНА ЖЕНЩИНА НА 30 МОРЯКОВ! История острова АНАТАХАН","Владимир Чайкин",14m 57s,https://www.youtube.com/watch?v=UJSlkBHnxHE&pp=ugUEEgJydQ%3D%3D
"Этого не покажут по телевизору: Северная Корея скрытой камерой","DW репортажи",5m 22s,https://www.youtube.com/watch?v=WHZxH0iSiB4
"The DR100 FREE Parasite SEO Site (FINAL BOSS)  - BIP641","Jacky Chou from Indexsy",13m 25s,https://www.youtube.com/watch?v=tCo2FVA7tMc&pp=ugUEEgJlbg%3D%3D
"5 Reasons You Should Solo Travel In Your 20s","Alex Bolivar",17m 15s,https://www.youtube.com/watch?v=A39tJc4A27A
"The 'new China' in Thailand: ‘if you want hope, you have to leave’","The Guardian",9m 25s,https://www.youtube.com/watch?v=oIDsvIQ0UvM
"КВАНТОВЫЙ МИР: ТЕЛЕПОРТАЦИЯ, МУЛЬТИВСЕЛЕННАЯ и КУБИТ ПЕТЯ","ОСНОВА",1h 14m 13s,https://www.youtube.com/watch?v=qPlfi3Wc6tI
"69 Bangkok Truths I Wish I Knew Sooner (Avoid Scams!)","Tim Travel Taste",29m 3s,https://www.youtube.com/watch?v=E9Lw8f6qPFU&pp=ugUEEgJlbg%3D%3D
"When The British Exchanged Nails For ""Favors"" From Tahitian Women","Simple History",9m 36s,https://www.youtube.com/watch?v=J1kDegLdAAo&pp=ugUHEgVlbi1HQg%3D%3D
"12 Rookie Dating Mistakes in the Philippines (THE REAL LIST)","Smart Girl Philippines",25m 47s,https://www.youtube.com/watch?v=c_jsTkuFs3Q&pp=ugUHEgVlbi1VUw%3D%3D
"Korean Girls Meet Adult Movie Star For The First Time","OSSC",9m 45s,https://www.youtube.com/watch?v=UkKNdefL1A8
"Google launches AI money","Wes Roth",24m 1s,https://www.youtube.com/watch?v=8s6nGMcyr7k
"World of Warcraft Dance Origins","NeynuSaloo",14m 6s,https://www.youtube.com/watch?v=2Sb94BZtz3A&list=RD2Sb94BZtz3A&start_radio=1&pp=oAcB
"Pros & Cons after 1 year in a VIETNAM Beach Town","Travis Travels Vietnam",9m 46s,https://www.youtube.com/watch?v=v6_D8Q3gcrY&pp=ugUHEgVlbi1VUw%3D%3D
"Batman Family vs Mr. Freeze & Bane | Batman & Robin","Flashback FM",4m 59s,https://www.youtube.com/watch?v=aR9bxhmcS_Q&pp=0gcJCeAJAYcqIYzv
"How to set up and use Alipay as a foreigner in China","Lyn | Honest Tips for Smart Travelers",4m 59s,https://www.youtube.com/watch?v=dleZ1EaHgog
"Kimmel SUSPENDED After Terrible Charlie Kirk Assassination Take","Ben Shapiro",1h 2m 15s,https://www.youtube.com/watch?v=NQbe1rZN7_w&pp=0gcJCeAJAYcqIYzv
"3I/ATLAS: СТРАННЫЙ ОБЪЕКТ СБЛИЖАЕТСЯ С ЗЕМЛЁЙ. Владимир Сурдин","Неземной подкаст Владимира Сурдина",25m 5s,https://www.youtube.com/watch?v=I4IwJ4tlv2o&pp=0gcJCeAJAYcqIYzv
"Relaxing Jazz in Corner Coffee Shop For Happy Morning | Great Jazz Music For Calm, Focus & Relax","Cozy Outdoor Jazz",3h 34m 2s,https://www.youtube.com/watch?v=pfx4r7_WdP8&list=RDpfx4r7_WdP8&start_radio=1&pp=oAcB
"Frank Sinatra’s Ultimate 1-Hour Playlist – Timeless Classics That Never Get Old","Uncollective Music Records",55m 53s,https://www.youtube.com/watch?v=ZERB_Pu-5s8&list=RDZERB_Pu-5s8&start_radio=1&pp=oAcB
"🇵🇭 Филиппинка ХОЧЕТ от меня детей / РАЙСКИЙ ПЛЯЖ на острове 🇵🇭","АНАНАСИК",11m 39s,https://www.youtube.com/watch?v=zaDkAGWYPHQ
"$500K Passport TRAP: This Country Just Scammed Investors","Wealthy Expat",10m 5s,https://www.youtube.com/watch?v=XZG-HGw6xXs&pp=ugUHEgVlbi1VUw%3D%3D
"Retired veteran leaves South Carolina for Thailand - Inside his $1200 month condo","Sam Tyler ",38m 44s,https://www.youtube.com/watch?v=pkVuSc8BH4w
"BIRCHPUNK - RUSSIAN SPACETRAIN // РУССКИЙ КОСМОПОЕЗД feat. BadComedian","birchpunk",7m 44s,https://www.youtube.com/watch?v=t7kr7utvVEs&list=RDt7kr7utvVEs&start_radio=1&pp=oAcB
"Welcome to the Mobile Infantry | Starship Troopers | CLIP 🔥 4K","Boxoffice Movie Scenes",5m 11s,https://www.youtube.com/watch?v=x3ioVVNIB9A
"Apps make $50K/mo like THIS (I shouldn't share this)","Greg Isenberg",27m 38s,https://www.youtube.com/watch?v=Px_X-qBQ18M
"Cozy Autumn Coffee Shop Ambience - Vintage 1940's Slow Jazz","barely jazz",3h 5s,https://www.youtube.com/watch?v=-BeExIeFBOs&list=RD-BeExIeFBOs&start_radio=1&pp=oAcB
"Как в Сальвадоре побороли преступность | Найиб Букеле и его политика (English subtitles) @Max_Katz ","Максим Кац",18m 58s,https://www.youtube.com/watch?v=OjwS30XYSP0
"I Was Selected for North Korea’s Pleasure Squad: My Experience (Part 1)","Deborah Choi: From North Korea to USA",12m 43s,https://www.youtube.com/watch?v=-kgUlwXX60Y
"Meet The Necromongers | The Chronicles Of Riddick | Science Fiction Station","Science Fiction Station",6m 42s,https://www.youtube.com/watch?v=FkvTfPmRIc4&pp=0gcJCeAJAYcqIYzv
"iPhone 17 Pro & Pro Max Review For Photographers!","PetaPixel",26m 14s,https://www.youtube.com/watch?v=bpqrCoy0ZHc
"КАСТЫ — Настоящий Секрет КИТАЙСКОГО ЧУДА! Почему все молчали??","SHANKANAKA",15m 10s,https://www.youtube.com/watch?v=gIVwPzK7C-g&pp=ugUEEgJydQ%3D%3D
"Thieves HATE This Travel Gear (Zero Thefts in 10 Years Abroad)","Project Untethered",15m 36s,https://www.youtube.com/watch?v=h-S0Lo6Xlr4&pp=ugUEEgJlbg%3D%3D
"I Visited World's Largest AI Show...You Won't Believe What China Did","Cyrus Janssen",10m 33s,https://www.youtube.com/watch?v=i3mFIpv_iCc&pp=ugUHEgVlbi1VUw%3D%3D
"Таиланд: Унижения в Вузе, Платная Любовь и Армия по Лотерее","Миша Мордасов",35m 57s,https://www.youtube.com/watch?v=xX-lwR5Wyg8
"Sunset Bossa Nova Covers 2025 🍂☕Chill Romantic Bossa Jazz For Unwind [ 𝒔𝒖𝒏𝒔𝒆𝒕 𝒂𝒖𝒕𝒖𝒎𝒏 𝒋𝒂𝒛𝒛 ]","𝗽𝗮𝗹𝗺 𝗽𝗮𝗹𝗺 𝘁𝘂𝗻𝗲𝘀",3h 7m 10s,https://www.youtube.com/watch?v=WOp6tkfnnUY&list=RDWOp6tkfnnUY&start_radio=1&pp=oAcB
"Tantric Sex & Semen Retention explained by a Monk & Harvard Psychiatrist | Dr. K","Rena Malik, M.D.",17m 2s,https://www.youtube.com/watch?v=Y9gfaSZbWVY
"Объехали весь Бали и вот что поняли... Цены, места, культура и советы туристу","2 чемодана",52m 30s,https://www.youtube.com/watch?v=mxH4EaXFvBs&pp=ugUEEgJydQ%3D%3D
"X-MEN: DAYS OF FUTURE PAST Clip - ""Sentinels"" (2014) Sci-Fi","JoBlo Movie Clips",4m 41s,https://www.youtube.com/watch?v=3krbNv1eBMY
"Nas - N.Y. State of Mind (Official Audio)","NasVEVO",4m 56s,https://www.youtube.com/watch?v=hI8A14Qcv68&list=RDhI8A14Qcv68&start_radio=1
"How A $6B Noodle Brand From Indonesia Became Nigeria’s National Dish | The Blueprint","THIRD",6m 16s,https://www.youtube.com/watch?v=LYs_nTnjp-k&pp=ugUEEgJlbtIHCQngCQGHKiGM7w%3D%3D
"Dubai Residency Made Easy: 2-Year Investor vs. 10-Year Golden Visa (2025 Guide)","DubaiCatch",6m 56s,https://www.youtube.com/watch?v=fUqx_d6DG2g
"Charlie Kirk Gives Only Fans Girl A Reality Check","Turning Point UK",5m 10s,https://www.youtube.com/watch?v=JOZf5LdKFH8
"How We Date, Find Love and Marry at −71°C (−95°F) Yakutsk, Siberia","Kiun B",10m 1s,https://www.youtube.com/watch?v=QPwE27KwNeQ&pp=ugUEEgJlbg%3D%3D
"Vintage Jazz Lounge – 1940s New York Bar Jazz to Relax & Unwind","Smooth Jazz",1h 3m 48s,https://www.youtube.com/watch?v=c286wPSZQIE&list=RDc286wPSZQIE&start_radio=1&t=206s&pp=oAcB
"How ""Free"" P*rn Sites Really Work (and Who Runs Them)","Theo Von Clips",12m 11s,https://www.youtube.com/watch?v=gI0zQMZoqEs
"The children groomed in Romania for the UK sex trade- BBC News","BBC News",13m 32s,https://www.youtube.com/watch?v=m12cgvH1R9w
"John Zorn - Karaim","The Alchemy of Happiness",15m,https://www.youtube.com/watch?v=8pNbhaQcyZY&list=RD8pNbhaQcyZY&start_radio=1
"Skyline: Inside the alien spaceship (HD CLIP)","Binge Society",4m 7s,https://www.youtube.com/watch?v=gpU1qfG1GOQ
"Thai Transgender (Ladyboy) Prostitute interview-Ellen","Soft White Underbelly",8m 22s,https://www.youtube.com/watch?v=6fl43W7hA0A
"Монгольское нашествие #4. Битва на Сити, осада Козельска | 1238 г.","Маховик Истории",12m 50s,https://www.youtube.com/watch?v=cJXYg1mIAyk
"How Much Did Roman Slaves Cost?","Para Bellum",19m 20s,https://www.youtube.com/watch?v=g0A_OxIX338&pp=ugUEEgJlbg%3D%3D
"Клим Жуков: Войны и колонизация — ключ к формированию современного мира","Кириллица",1h 28m 52s,https://www.youtube.com/watch?v=LdF6H4MNctQ
"Before you get a ""Special"" Massage in Thailand... Watch This (2025)","Real Talk Thailand",11m 21s,https://www.youtube.com/watch?v=KQV8nyYzX0U
"Falling Into Jupiter (Simulation)","Stargaze",5m 4s,https://www.youtube.com/watch?v=fbn-tuYcScI&list=RDfbn-tuYcScI&start_radio=1&pp=oAcB
"Samchem Medley -   Famous Jewish Music -  jewish song","The Soul of Jewish Music",6m,https://www.youtube.com/watch?v=K7NEaqredGQ&list=RDK7NEaqredGQ&start_radio=1
"Рубрика ""Как в кино"" - Образцово-показательный подход в direct style (Вики Кристина Барселона)","iwantmoreru",4m 16s,https://www.youtube.com/watch?v=eeSsMBqBhgg
"Wu-Tang Clan - Protect Ya Neck (Official HD Video)","WuTangClanVEVO",4m 50s,https://www.youtube.com/watch?v=R0IUR4gkPIE&list=RDR0IUR4gkPIE&start_radio=1
"Трудности – это твой путь к величию? Глава недели «Ницавим». Рав Шмуэль Каминецкий","МЕНОРА",5m 23s,https://www.youtube.com/watch?v=-jJDLdV-5sc&pp=ugUEEgJydQ%3D%3D
"Cafe De Anatolia - Best Arabic Deep House & Around The World & Arabic Remix [Music DJ Mix 2025]","Cafe De Anatolia ETHNO WORLD",2h 8m 4s,https://www.youtube.com/watch?v=ZrP3_5wxGkU&list=RDZrP3_5wxGkU&start_radio=1&pp=oAcB
"STDs in Thailand Part 2 - More Things You Need to Know","Ryan's Travels",6m 46s,https://www.youtube.com/watch?v=mirwU4VbFsY&pp=0gcJCeAJAYcqIYzv
"Sex, drugs, money and murder in Thailand’s Monkhood | Foreign Correspondent","ABC News In-depth",30m 2s,https://www.youtube.com/watch?v=jyJJmMSnqdM
"How much Do Japanese Girls Cheat?","TAKASHii",10m 57s,https://www.youtube.com/watch?v=b22jxhg0OVo
"Прометей/Чужой - Вырезанные Диалоги Инженеров","GoodMovies",18m 54s,https://www.youtube.com/watch?v=OlEld-GJgQs
"How to Count Thai Numbers  - Your Key to Easy Market Shopping!🇹🇭","Opal's Story",10m 31s,https://www.youtube.com/watch?v=m0UCVyLASyA
"ДЖУМАГАЛИЕВ: Людоед, сбежавший из психушки / Серийный номер 17 @MINAEVLIVE","МИНАЕВ LIVE",57m 40s,https://www.youtube.com/watch?v=wATVIdJ6_UA
"FOUNDATION Season 3 Ending Explained & Season 4 Theories!","Think Story",19m 22s,https://www.youtube.com/watch?v=44sgo52Z0MQ&pp=ugUEEgJlbg%3D%3D
"История мошенника из «Тиндера», который зарабатывал на обмане женщин","Котрикадзе иностранных дел",3m 41s,https://www.youtube.com/watch?v=M5dzL176F2o&pp=0gcJCeAJAYcqIYzv
"Why Hiring a Tour Guide in the Philippines is your Best Choice!","DearANNIE in the Philippines ",8m 27s,https://www.youtube.com/watch?v=fOkzYlc3Dq0
"The Future of AI and SaaS is Agentic Experiences (Here's How to Build Them)","Cole Medin",20m 47s,https://www.youtube.com/watch?v=BcvjGTxzK40
"НА ПХУКЕТ со своим африканским ""самоваром"" / ТАИЛАНД 2025","ПЛАНЕТКА",25m 54s,https://www.youtube.com/watch?v=HmRaRSuiwAs
"1940's Retro Jazz | Vintage Jazz 1","barely jazz",1h 10m 35s,https://www.youtube.com/watch?v=7Yb7QDEc4rw&list=RD7Yb7QDEc4rw&start_radio=1&t=85s&pp=oAcB
"EXPOSED: Google’s SECRET Ranking Signals (Antitrust Court Docs - BIP638","Jacky Chou from Indexsy",12m 23s,https://www.youtube.com/watch?v=YDGHN3meMW8&pp=ugUEEgJlbg%3D%3D
"Frank Sinatra - All Or Nothing At All (1982)","SÉNU BVLGARI",3m 10s,https://www.youtube.com/watch?v=dHBulKUTyOE&list=RDdHBulKUTyOE&start_radio=1&pp=0gcJCaIEOCosWNin
"Cost of living in Da Nang, Vietnam (Realistic Budget in the World's Cheapest Country)","Josh On The Move",11m 45s,https://www.youtube.com/watch?v=bnG06Mn5g2E&pp=ugUEEgJlbg%3D%3D
"Bangkok Guide for First Timers (save MONEY & TIME!)","Tim Travel Taste",18m 18s,https://www.youtube.com/watch?v=SKHl-pRCMw0
"'Our Genocide': How do Israelis feel about the war in Gaza? | On the Ground","The Guardian",15m 34s,https://www.youtube.com/watch?v=nMyyVaiY4V8
"TAНЗАНИЯ: ""300 баксов за секс???"" / Ночная жизнь Занзибара","ПЛАНЕТКА",41m 13s,https://www.youtube.com/watch?v=0SPyiXyRy1Q
"All Or Nothing At All","Frank Sinatra - Topic",3m 45s,https://www.youtube.com/watch?v=fFIdCUKSs-w&list=RDfFIdCUKSs-w&start_radio=1&pp=oAcB
"iPhone 17 Pro Max Review - Even BETTER Than You Think!","Dave2D",9m 49s,https://www.youtube.com/watch?v=X763A7yGh5E
"It Had To Be You","Frank Sinatra - Topic",3m 55s,https://www.youtube.com/watch?v=BXmEJL1mnuU&list=RDBXmEJL1mnuU&start_radio=1&pp=oAcB0gcJCeAJAYcqIYzv
"Prometheus | Young Peter Weyland TED Talk | ALIEN ANTHOLOGY","Alien Anthology",4m 40s,https://www.youtube.com/watch?v=a1E_mxgqngI
"ПАТТАЙЯ - ГОРОД ГРЕХА / отжали у транса все деньги. За что? / ТАИЛАНД!","ПЛАНЕТКА",36m 10s,https://www.youtube.com/watch?v=2emvevUdS-A&t=127s&pp=0gcJCeAJAYcqIYzv
"Grace Jones - Pull Up To The Bumper","GraceJonesVEVO",3m 58s,https://www.youtube.com/watch?v=Tc1IphRx1pk&list=RDTc1IphRx1pk&start_radio=1&pp=oAcB
"X-Men Apocalypse- All Powers from the film","All Powers Explained",6m 18s,https://www.youtube.com/watch?v=Rr_KSc9utMM
"Vanilla Stranglethorn Vale - Music & Ambience (3 hours, World of Warcraft Classic)","Meisio",3h,https://www.youtube.com/watch?v=9fWeZxI2SDQ&list=RD9fWeZxI2SDQ&start_radio=1&pp=oAcB
"24 -Hour Spas in China are Life changing! 🇨🇳","Travis Leon",8m 5s,https://www.youtube.com/watch?v=mHBuhtcYHrE&pp=ugUEEgJlbg%3D%3D
"ЛУЧШАЯ СТРАНА В МИРЕ / раскованные мусульманки, дорогущий алкоголь, отсутствие туристов / Бангладеш","ПЛАНЕТКА",56m 13s,https://www.youtube.com/watch?v=DMiu-thHkd4&t=291s
"ОСАКА / вечер с гейшей, японский хэви-метал и китайские пр..итутки / OSAKA JAPAN","ПЛАНЕТКА",44m 1s,https://www.youtube.com/watch?v=ZYcgNni5vu4&pp=0gcJCeAJAYcqIYzv
"Unlock WeChat Pay as a Foreigner: Now with Apple Pay - Step-by-Step Guide!","Lyn | Honest Tips for Smart Travelers",11m 35s,https://www.youtube.com/watch?v=GVkHvwjNaTg
"Apple CEO Tim Cook: Tariffs are a motivating factor for any business right now","CNBC Television",12m 58s,https://www.youtube.com/watch?v=epL2dh1MN7A
"How To Build Web Apps using V0 + Claude AI + Cursor AI","Ras Mic",13m 32s,https://www.youtube.com/watch?v=grc0YSEdUQY
"Schema Is Useless for LLMs: The SEO Lie That’s Finally Exposed","Edward Sturm",9m 12s,https://www.youtube.com/watch?v=7xIrGl2EZb4&pp=ugUEEgJlbg%3D%3D
"Karkaroff exposes Barty Crouch Jr. | Full Scene | Harry Potter and the Goblet of Fire","Harry Potter",7m 9s,https://www.youtube.com/watch?v=znmw_lOWnaA
"Хлопотливая жизнь Авессалома Изнуренкова. Всеволод Ларионов в фильме ""12 стульев"" (1976)","Советские фильмы, спектакли и телепередачи ",8m 40s,https://www.youtube.com/watch?v=WjPuUEfGIzQ
"How AI is changing the job market - What in the World podcast, BBC World Service","BBC World Service",13m 56s,https://www.youtube.com/watch?v=p_kF_SDB0-c
"Busta Rhymes - Break Ya Neck (Official Video)","BustaRhymesVEVO",5m 54s,https://www.youtube.com/watch?v=W7FfCJb8JZQ&list=RDW7FfCJb8JZQ&start_radio=1
"Rent-a-sister: Coaxing Japan’s hikikomori men out of their bedrooms - BBC News","BBC News",12m 56s,https://www.youtube.com/watch?v=q9IRmUEsz6g
"Battle on Ice | Batman & Robin","Flashback FM",4m 49s,https://www.youtube.com/watch?v=-f5f9jmigQQ
"Medellin: Inside the sex tourism capital of Colombia","Channel 4 News",11m 32s,https://www.youtube.com/watch?v=B3exT9GyN3w
"Urologist explains can you INCREASE your semen VOLUME?! | Shooters vs. Dribblers?!","Rena Malik, M.D.",7m 23s,https://www.youtube.com/watch?v=JOfEKv3tEl4&pp=ugUEEgJlbg%3D%3D
"I Lived in Dubai in the SUMMER - How Bad Is it? 🇦🇪","Tuomas",13m 40s,https://www.youtube.com/watch?v=c_jXAsD2wis&pp=ugUEEgJlbg%3D%3D
"Пугачёва у Гордеевой | Почему такие интервью важны (English subtitles) @Max_Katz","Максим Кац",11m 28s,https://www.youtube.com/watch?v=QPwjG6tSTn8&pp=0gcJCeAJAYcqIYzv
"Кто подбивает Путина напасть на Европу. Христо Грозев","Телеканал Дождь",11m 13s,https://www.youtube.com/watch?v=dbhORU6_UKM
"Dexter Kills Trinity 🔪 Dexter","Dexter Official",4m 24s,https://www.youtube.com/watch?v=VSVDenUugVQ
"Da Nang VIETNAM Cost of Living in 2025 (Insights for Couples)","Evan Eh! 🇨🇦",21m 37s,https://www.youtube.com/watch?v=e7n1hlamGVU
"스타크래프트 테란 노래,음악 4가지//StarCraft   Terran BGM","겜창돌이",22m 27s,https://www.youtube.com/watch?v=NEa0KmYsFdw&list=RDNEa0KmYsFdw&start_radio=1&pp=oAcB
"Богатая жизнь в Северной Корее изнутри","Коллектив",34m 5s,https://www.youtube.com/watch?v=Cq9b_eSv-3M&t=1216s
"BREAKING: Leavitt Castigates Journalists To Their Faces Over Lack Of Iryna Zarutska Killing Coverage","Forbes Breaking News",5m 53s,https://www.youtube.com/watch?v=4qzy6x0uZyI
"Крепостное право и зарождение декабризма / Борис Кипнис и Егор Яковлев","Цифровая история",49m 57s,https://www.youtube.com/watch?v=zXr5pZt_0XE
"Expat is Leaving Thailand after 10 years… for Vietnam?","The Cost of Living Abroad",46m 28s,https://www.youtube.com/watch?v=pkjX_gtvZvk&pp=ugUHEgVlbi1DQQ%3D%3D
"Santorini: Magical Island or Overcrowded Nightmare?","DW Travel",5m 38s,https://www.youtube.com/watch?v=vduX5uIwpb4
"Why We Left Everything in AMERICA To Start Over in VIETNAM","Tuakah and Anna",13m 11s,https://www.youtube.com/watch?v=H2YYuSrxY8g&pp=ugUEEgJlbg%3D%3D
"Chateau","Rob Dougan - Topic",3m 24s,https://www.youtube.com/watch?v=KCNOe7s1lD0&list=RDKCNOe7s1lD0&start_radio=1&pp=oAcB
"Foundation — Demerzel: Behind the Scenes with Laura Birn | Apple TV+","Apple TV",2m 30s,https://www.youtube.com/watch?v=VPVSck6yo1M
"Inglourious Basterds (2009): 'How many glasses?' Full Scene","Binge Society",10m 1s,https://www.youtube.com/watch?v=ad5ZSWNnCcQ
"Red Alert 3 Intro (Russian)","AltzGamer",6m 51s,https://www.youtube.com/watch?v=a6J22rj18BI
"Why You Should Date Younger Filipinas: ripe mangos get picked","Smart Girl Philippines",14m 33s,https://www.youtube.com/watch?v=TIfWY2g-CQg&pp=ugUHEgVlbi1VUw%3D%3D
"I Was Drugged in Colombia and Survived | Travel Story 🇨🇴","No Travel No Vida",11m 9s,https://www.youtube.com/watch?v=NrxytZ8tShk
"Family Guy - Quagmire's Korean Lifestyle","Hippie Joe",4m 57s,https://www.youtube.com/watch?v=G0bLWbc4MCE
"Легендарный монолог Жванецкого ""Дефицит"" исполняет Аркадий Райкин (1974)","Советский юмор",4m 41s,https://www.youtube.com/watch?v=5x3FEcrWcm4
"Eazy E - Boyz-n-the-Hood (Music Video)","TheHipHopSyko",6m 31s,https://www.youtube.com/watch?v=PIU07K_28ck&list=RDPIU07K_28ck&start_radio=1&pp=oAcB0gcJCeAJAYcqIYzv
"Supernova Swag","YTCracker - Topic",3m 41s,https://www.youtube.com/watch?v=iGKFpG9LueY&list=RDiGKFpG9LueY&start_radio=1
"I've Got You Under My Skin (Remastered 1998)","Frank Sinatra - Topic",3m 44s,https://www.youtube.com/watch?v=zEWjHSvNnI0&list=RDzEWjHSvNnI0&start_radio=1&pp=oAcB
"WoW Lofi Beats To Chill To | Waiting for BlizzCon","World of Warcraft",3h 2m 49s,https://www.youtube.com/watch?v=-uxi6_5cFqw&list=RD-uxi6_5cFqw&start_radio=1&pp=oAcB
"Dimensius' Theme (Favorite Parts) - Music of WoW The War Within 11.2: Ghosts of K'aresh","Yodragon",4m 37s,https://www.youtube.com/watch?v=IwGFRg3zhlg&list=RDIwGFRg3zhlg&start_radio=1&pp=oAcB
"My Secret To Better Erections","Bryan Johnson",4m 13s,https://www.youtube.com/watch?v=GZqpJ9mXZ88
"Terran Two","Release - Topic",3m 57s,https://www.youtube.com/watch?v=2BiiqC3SD24&list=RD2BiiqC3SD24&start_radio=1&pp=oAcB
"First Hour In BANGKOK - 15 Worst Mistakes To Avoid","Cal",18m 23s,https://www.youtube.com/watch?v=D2A-Jf_u9V4
"Dearest Helena - Starcraft II Soundtrack Supercut","Larsen",57s,https://www.youtube.com/watch?v=vxa2HS9hs-s&list=RDvxa2HS9hs-s&start_radio=1&pp=oAcB
"КАБО-ВЕРДЕ / пикап креолок на пляже закончился обломом / 2 серия","ПЛАНЕТКА",24m 23s,https://www.youtube.com/watch?v=DlBkv3hZCgU
"МОМБАСА - секс-столица Восточной Африки / КЕНИЯ","ПЛАНЕТКА",35m 35s,https://www.youtube.com/watch?v=w9FFvodN-3I
"БЕЛЫЕ ЛАТИНОАМЕРИКАНКИ / горячие и $и$ястые / Аргентина, Уругвай, Парагвай","ПЛАНЕТКА",52m 52s,https://www.youtube.com/watch?v=T0uYDSgo0w4&t=965s&pp=0gcJCeAJAYcqIYzv
"ДЕВОЧКИ МАДАГАСКАРА: ""отдаются с душой"" / ЧЕМ ОНИ ХОРОШИ И ЧТО С НИМИ НЕ ТАК / 3 серия","ПЛАНЕТКА",35m 14s,https://www.youtube.com/watch?v=BufECv23AUA&t=994s&pp=0gcJCeAJAYcqIYzv
"ФИЛИППИНЫ / жизнь в глубинке / едем с филиппинкой по островам!","ПЛАНЕТКА",24m 3s,https://www.youtube.com/watch?v=XsbxvPrYC4M&t=627s
"ГАВАНА / стоит ли жениться на кубинках - когда прилетел к ней без предупреждения  / Cuba Havana","ПЛАНЕТКА",48m 28s,https://www.youtube.com/watch?v=xneLp9MEWwk&t=1096s
"МАДАГАСКАР: при расставании она не выдержала и ... / 4 серия MADAGASCAR","ПЛАНЕТКА",29m 46s,https://www.youtube.com/watch?v=jmJ8Fw0McA8&t=1286s
"ТУРКМЕНИСТАН: КАК Я ТУДА ПОПАЛ?!  /самая закрытая страна мира и что же ТАКОГО она скрывает?","ПЛАНЕТКА",56m 3s,https://www.youtube.com/watch?v=QbIwAIqP2u8
"Why He Left Bangkok for Da Nang Vietnam | Condo Tour + $1500/mo Lifestyle","Paul Lee",25m 52s,https://www.youtube.com/watch?v=d4Zonc9tj2A
"История религии. Часть 1. Есть ли бог?","Клим Жуков",48m 52s,https://www.youtube.com/watch?v=Hr8QArGTxTQ&list=PLUuqyGc-1E3pLB-P3iaow4glvGWCu4vTz&pp=iAQB
"Как Китай Уничтожил Семью и Брак? Касты, Расчеты, Убийство","SHANKANAKA",15m 30s,https://www.youtube.com/watch?v=CYkT2ljR9eI
"ВПНизация страны | Ответ россиян на белые списки (English subtitles) @Max_Katz","Максим Кац",17m,https://www.youtube.com/watch?v=sCV73rWzsd0
"КРЕОЛКИ С КАБО-ВЕРДЕ: все по 50 евро! и девятерых девушек нам оказалось мало! / 3 серия","ПЛАНЕТКА",27m 16s,https://www.youtube.com/watch?v=Jdlx4IXDzoc
"FRANK SINATRA Mix Of Most Popular Songs NO ADS","Music Maniac ",22m 35s,https://www.youtube.com/watch?v=9bZaqJvvdds&list=RD9bZaqJvvdds&start_radio=1&pp=oAcB
"4,590,000 THB ($133,000) New Oceanfront Apartment in Pattaya, Thailand","Farang Homes",16m 40s,https://www.youtube.com/watch?v=7PC11X6g6d4&t=129s
"КАТМАНДУ ДЛЯ ВЗРОСЛЫХ / ""снимешь с меня это сари?"" - злачная сторона столицы Непала","ПЛАНЕТКА",27m 54s,https://www.youtube.com/watch?v=fYdJSySKqZc&pp=0gcJCeAJAYcqIYzv
"17 things I wish I knew before visiting CHINA 🇨🇳","Joel and Emilia",15m 12s,https://www.youtube.com/watch?v=efDOVVDy0iA
"""ВАРШАВА - мать городов русских!"" / ПОЛЬША В 2024","ПЛАНЕТКА",38m 9s,https://www.youtube.com/watch?v=yMw2kMQM0CE
"Would You Live Here for $600? 10 Years in a Vietnam Beach Town","Evan Eh! 🇨🇦",25m,https://www.youtube.com/watch?v=g1ouHlxSpTE&pp=ugUHEgVlbi1VUw%3D%3D
"Pattaya Guide for First Timers (save MONEY & TIME!)","Tim Travel Taste",19m 48s,https://www.youtube.com/watch?v=XdWKFhth5uM
"Жуков и Исаев: КВ-1 и КВ-2 - несокрушимые машины с непростой судьбой","Клим Жуков",1h 42m 7s,https://www.youtube.com/watch?v=4V3hzw9e8P0
"ДАНАНГ или ПХУКЕТ: КУДА ЛУЧШЕ в 2025? ПОДРОБНОЕ СРАВНЕНИЕ | Вьетнам или Таиланд?","Илья Якунин",26m 34s,https://www.youtube.com/watch?v=ip1y0dK0ML0
"Why men have urinary dribble and what to do about it! | After Dribble","Rena Malik, M.D.",6m,https://www.youtube.com/watch?v=k9Uoniw9Byk&pp=ugUEEgJlbg%3D%3D
"Белковский + Бунтман.  18 Сентября 2025 @BelkovskiyS","Белковский",58m 21s,https://www.youtube.com/watch?v=8-tgvP1W4Ss
"К нам ПРИЕХАЛА её лучшая ПОДРУГА... Помогите!","Пад Тай",16m 33s,https://www.youtube.com/watch?v=HBjjqawPvVY
"Australian took me inside a factory in Thailand… not what BBC shows you","Max Chernov",45m 23s,https://www.youtube.com/watch?v=eCXu5oOerEs
