Title,Channel,Duration,URL
"ЛЕЧИМ и КАЛЕЧИМ: как россиян губят ""Виагрой""","ченгелина арток",13m 24s,https://www.youtube.com/watch?v=o_xFsOTpb6E&pp=ugUEEgJydQ%3D%3D
"От приговора девушке-фармацевту, в пьяном виде погубившей человека, её мать рухнула в обморок","Кстати Новости Нижнего Новгорода",3m 56s,https://www.youtube.com/watch?v=1IaoNHOvloY
"Изучил 1000 ai стартапов, эти 10 самые интересные","Матрица",8m 18s,https://www.youtube.com/watch?v=J5FOeo1OWVU
"⚡️НОВОСТИ | ЗЕМЛЕТРЯСЕНИЕ В РОССИИ | ТРАМП ГРОЗИТ ПУТИНУ | ПРОБКА НА ГРАНИЦЕ С КАЗАХСТАНОМ | ПРОТЕСТ","Ходорковский LIVE",10m 17s,https://www.youtube.com/watch?v=3sbROjXQpRI
"Yuval Noah Harari on Israel, AI, and the future of humanity","PoliticsJOE",1h 7m 2s,https://www.youtube.com/watch?v=m7tsa_5LFwQ
"Буллинг, нищенские зарплаты, маскировочные сети и «Разговоры о важном»: монолог учителя","Новая газета Европа",15m 29s,https://www.youtube.com/watch?v=m_s7mMogzcw&pp=ugUEEgJydQ%3D%3D
"World of Warcraft: Midnight Already Has One Big Problem","Nixxiom",18m 20s,https://www.youtube.com/watch?v=kj7mV6mmYTg
"Женский стендап: Карина Мейханаджян – шутки на первом свидании   @TNT_television    ​","ТНТ",8m 49s,https://www.youtube.com/watch?v=hqUpSAyMqNU
"О.С.П - Русский Патриот","AquaBit",4m 49s,https://www.youtube.com/watch?v=57CUizFngL8&list=RD57CUizFngL8&start_radio=1&pp=oAcB
"French Girl Waited 55 Years for a Chinese Boy - Married Him at 83 Finally","Panda Stories",9m 24s,https://www.youtube.com/watch?v=x3-m49IpNI8
"Налоги поднимут. Автомобили подорожают. Любовница Путина. Удар по НПЗ | ГАЛЛЯМОВ, БЛАНТ | ВОЗДУХ","Ходорковский LIVE",40m 27s,https://www.youtube.com/watch?v=sCGp4OCiGfw
"Чайнатаун в США: китайские мигранты захватывают Запад? | Нью-Йорк, Трамп, Китай, паленые лабубу","Varlamov Travel",1h 33m 39s,https://www.youtube.com/watch?v=Hm-2cnBqfz8
"Мощное землетрясение на Камчатке. Путин отрицает проблемы с бюджетом. Трамп угрожает своим критикам","Телеканал Дождь",51m 35s,https://www.youtube.com/watch?v=x_QYmBdtp6s&pp=0gcJCeAJAYcqIYzv
"Неудобные Вопросы Монаху: Аяваска, Кредиты и Сны.","Уроки Медитации",14m 57s,https://www.youtube.com/watch?v=WVfnwxyhZyE&pp=ugUEEgJydQ%3D%3D
"Мультисиг кошелек: Как крупный капитал хранит биткоин | Пошаговая настройка 2-из-3","sunscrypt",32m 51s,https://www.youtube.com/watch?v=VzqeBBv_0oQ
"Why Do People Even Come To Thailand Anymore? 🇹🇭🇮🇳","Bobby Thompson",9m 46s,https://www.youtube.com/watch?v=pqx9JjJCbI0&pp=ugUEEgJlbg%3D%3D
"Ждут ли Ригу рейды против мигрантов и ограничение числа студентов из третьих стран?","Настоящее Время. Балтия",6m 23s,https://www.youtube.com/watch?v=aBiMNqBifFc
"Наши 10 Плюсов жизни во Вьетнаме. ЧТО нам здесь нравится","Yar Life",38m 24s,https://www.youtube.com/watch?v=0xwtzR4MfwY
"BANGKOK This Is Really Happening | Don't Plan & Do What You Can | Be Positive #livelovethailand","Live Love Thailand",9m 56s,https://www.youtube.com/watch?v=KzdR3kWQRh4&pp=ugUEEgJlbg%3D%3D
"Почему возникает рак и как его предотвратить. Всему виной лактат","doctorpetrik",56m 51s,https://www.youtube.com/watch?v=FSH3_IZk_uY&t=128s
"本日の大久保公園・夜の新宿歌舞伎町をお散歩！ラブホテル街 Night Walk in Tokyo Shinjuku Kabukicho Okubo Park Relaxing Japan Walk","Monster Walker",41m 4s,https://www.youtube.com/watch?v=ydiNZrKGUm0
"40 Year Olds Share Advice for Younger Self","Sprouht",13m 1s,https://www.youtube.com/watch?v=ZukIfM7Yy_8&pp=ugUEEgJlbg%3D%3D
"Легализация в Уругвае. Как получить ПМЖ и какие документы нужны?","Kventista travel",16m 37s,https://www.youtube.com/watch?v=PLVTSe8hlx0&pp=ugUEEgJydQ%3D%3D
"Обзор macOS Tahoe (МакЛикбез)","МакЛикбез",21m 16s,https://www.youtube.com/watch?v=4Q4YV3YtIOU&pp=ugUEEgJydQ%3D%3D
"Это Лучшие Места Паттайи 2025! Вы должны это увидеть...","Elena Morozova Vlog Thailand",20m 52s,https://www.youtube.com/watch?v=0Gu0XOexXr8
"Презентация Neuralink 2025: Сверхзрение, телепатия и новые органы чувств","Илон Маск (Elon Musk Russia)",1h 35s,https://www.youtube.com/watch?v=BH2ETug6hb0
"LinkedIn Co-Founder Opens Up on the Reality of AI Job Loss | EP #194","Peter H. Diamandis",1h 43m 30s,https://www.youtube.com/watch?v=mbbG0RSkpFw
"Анаконда — Русский трейлер (2025)","HypeFilms",2m 34s,https://www.youtube.com/watch?v=6d8104NsUQU
"When You're Friend Gets Back From Burning Man","AwakenWithJP",6m 47s,https://www.youtube.com/watch?v=a8zMNbPEwaY&pp=ugUEEgJlbtIHCQngCQGHKiGM7w%3D%3D
"ШРИ-ЛАНКА или ВЬЕТНАМ: где лучше и дешевле в 2025 году? Сравниваем после 6 лет жизни в Шри-Ланке","We Team",48m 7s,https://www.youtube.com/watch?v=t140XFOUDaA&pp=0gcJCeAJAYcqIYzv
"The great porn experiment | Gary Wilson | TEDxGlasgow","TEDx Talks",16m 29s,https://www.youtube.com/watch?v=wSF82AwSDiU
"Foreigners SHOCKED By EAGER Asian Women","Asian Women Official",6m 21s,https://www.youtube.com/watch?v=rVtVufxc7PY
"7 Ловушек на пути к Мастерству в своем деле.","Про Успех - Коуч Джордж",14m 39s,https://www.youtube.com/watch?v=aNXn0rBsJBo
"ЭТУ ЯИЧНИЦУ ЕДЯТ ТОЛЬКО ИЗБРАННЫЕ! Рецепт от Максима Галкина, который вас шокирует.","В гостях у Макса",7m 5s,https://www.youtube.com/watch?v=p1CUA6zPiPA&pp=ugUEEgJydQ%3D%3D
"Santo Rosário | 40 Dias com São Miguel Arcanjo 2025 | 03:40 | 19/09 | 32° Dia | Live Ao vivo","Frei Gilson / Som do Monte - OFICIAL",5h 41m 45s,https://www.youtube.com/watch?v=OAjEWGpTRQk
"Is AI Killing the Economy? (Anthropic Report)","Matthew Berman",16m 30s,https://www.youtube.com/watch?v=biwwQw0248w
"Анаконда — Русский трейлер (Дубляж, 2025, 4К)","Kinoman",2m 34s,https://www.youtube.com/watch?v=tW2nIOoLVok
"Taylor Kitsch on His Intense Training for Lone Survivor","JRE Clips",15m 19s,https://www.youtube.com/watch?v=2uDTrB8Y_ks
"Как Проститутки Создают ""НАСТОЯЩИХ МУЖЧИН"" в Китае? КИТАЙ 18+","SHANKANAKA",16m 16s,https://www.youtube.com/watch?v=a9H-NkL_z4Q
"Ученые получили ответ на вопрос, одни ли мы во Вселенной?","Ирина Якутенко",1h 15m 1s,https://www.youtube.com/watch?v=9Km30GM1Vo4
"🔥Vietnam Nightlife - Little Japan Tour🔥Ho Chi Minh Saigon 4K - June 26","NightlifeNomad",12m 13s,https://www.youtube.com/watch?v=IPv7eTsmhsM
"5 минут смерти.  ДМТ - Что люди видят под САМЫМ СИЛЬНЫМ ГАЛЛЮЦИНОГЕНОМ?","Клиника доктора Шурова",27m 49s,https://www.youtube.com/watch?v=FGupicobvSg&t=1151s
"Lagu Kebangsaan Wilayah Persekutuan  ""Maju dan Sejahtera""","IPC Indonesia Project",1m 37s,https://www.youtube.com/watch?v=XccrldrqTFU&list=RDXccrldrqTFU&start_radio=1&pp=oAcB
"Юлия Латынина /  ""хоккейная клюшка"" и глобальное потепление/ LatyninaTV /","Yulia Latynina",51m 48s,https://www.youtube.com/watch?v=MMuS4nl2EJ4&list=PLFCc7vDsPVrjFWksht8Ce6Z8H6i0XxCVz&pp=0gcJCaIEOCosWNin
"Сергей Орлов - СТЕНД АП ЦЕЛЫЙ ДЕНЬ","Сергей Орлов",53m 40s,https://www.youtube.com/watch?v=7XX55CguwEk&pp=0gcJCeAJAYcqIYzv
"The Most Dangerous Trade in the World Is Unraveling – Bert Dohmen","Kitco NEWS",33m 24s,https://www.youtube.com/watch?v=HszvvoUTofg&pp=ugUHEgVlbi1VU9IHCQngCQGHKiGM7w%3D%3D
"Сергей Алексашенко. Санкции устанавливают чиновники, а обходят их бизнесмены","Yulia Latynina",1h 39m 20s,https://www.youtube.com/watch?v=18ONSeC0abw&list=PLFCc7vDsPVrjLjrz2jmAbVIXB5QxJJRtK
"ТАКОЙ Я ЖИТЬ НЕ ХОЧУ/ Почему пожилые убивают себя?","SHANKANAKA",13m 1s,https://www.youtube.com/watch?v=MMBm5C8v1_4
"70 Year Old Escort On Her Strangest Requests | Honesty Box","LADbible Stories",16m 38s,https://www.youtube.com/watch?v=FuVaGzJ4V3g
"PANCINGAN PENJEBOL BIR4HI SRDC MALAS BUNYI - sikatan rimba dada coklat (cyornis olivacea)","Kicau Sensasy",12m 9s,https://www.youtube.com/watch?v=PztubKJWeBg
"翻盖手舞 (抖音版)","尹洋 - Topic",1m 9s,https://www.youtube.com/watch?v=PLEuovSM45E&list=RDPLEuovSM45E&start_radio=1&pp=oAcB0gcJCeAJAYcqIYzv
"Bill O'Reilly: Trump Hatred 'Consumed' Jimmy Kimmel","Bill O'Reilly",11m 31s,https://www.youtube.com/watch?v=4BAdDzupVUE
"Рак молодеет? Онколог Титов о новой эпидемии, психосоматике болезни, симптомах и смертельной ошибке","Александр Соколовский",1h 54m 59s,https://www.youtube.com/watch?v=kC9DK3VWXrw
"История серийного убийцы эскортниц: маньяк Алексей Варакин вернулся спустя 13 лет","ЛенТВ24",2m 26s,https://www.youtube.com/watch?v=q_uRU1d3Rks
"Belgium revolutionises status of sex workers, but not everyone is happy • FRANCE 24 English","FRANCE 24 English",5m 18s,https://www.youtube.com/watch?v=1eVSfYaOzq0
"Захват Газы: Израиль начал масштабную военную операцию","Сергей Ауслендер",19m 43s,https://www.youtube.com/watch?v=cGRwWTgNZLc&pp=ugUEEgJydQ%3D%3D
"Sex Worker Interview❤️The Realities of the Job in Japan","Japanese girls interview",8m 54s,https://www.youtube.com/watch?v=j7hGd5KYzeg
"Раннее Египетское царство","Клим Жуков",23m 26s,https://www.youtube.com/watch?v=kbr4TmdKKuY
"UNA NOTTE NEL QUARTIERE TRANS DI BANGKOK 🇹🇭","Progetto Happiness",19m 25s,https://www.youtube.com/watch?v=T9VjpV5hhMs
"India's Acid Attack Survivors | Close Up","Al Jazeera English",18m 21s,https://www.youtube.com/watch?v=1PVnVmtl8ZI
"Обзор iPhone 17 Pro / Max — лучший выбор","Rozetked",13m 37s,https://www.youtube.com/watch?v=kMyEYy0h8Eo
"Why It Sucks to Be a Brothel Boy (in Qing Dynasty)","Bernard",15m 19s,https://www.youtube.com/watch?v=HMsbA6Tp0A8
"Человечество навсегда ЗАПЕРТО в Солнечной системе? Астрофизик Борис Штерн раскрыл неприятную правду","Глеб Соломин",1h 1m 17s,https://www.youtube.com/watch?v=p0Ri2tNb-6I
"Как вы можете угодить в секту?","Коллектив",32m 36s,https://www.youtube.com/watch?v=UYqbx8rODW0
"Опиумные войны в Китае / Уроки истории / МИНАЕВ","МИНАЕВ LIVE",36m 48s,https://www.youtube.com/watch?v=So64Jj3EmHo
"(R) Бред величия (полная версия) Маниакальный синдром. Шизофрения © Delusions of Grandeur","M E Д Ф И Л Ь М",18m 6s,https://www.youtube.com/watch?v=UIgkwY6dRpE
"This Week in History: The U.S. Air Force is established and more headlines (Patriot Premium)","Fox News",5m 5s,https://www.youtube.com/watch?v=xZ0xJ6BU2cI
"Bossa Nova Music - Best Bossa Nova Covers of Popular Songs for Study, Work & Deep Focus ☀️🌴","Enya Bossa",1h 47m 43s,https://www.youtube.com/watch?v=1bBAx4nMt2o&list=RD1bBAx4nMt2o&start_radio=1&pp=oAcB
"Are These the Coolest Glasses Ever Made?","Robots With Opinions",7m 36s,https://www.youtube.com/watch?v=_MqEeW2OyBM
"My Phuket Girlfriend’s Serenity Mask Hid a Ruthless Scam Network!","Retired Tales",40m 29s,https://www.youtube.com/watch?v=uyYGhB7UaQQ
"Amazon Just Launched Its Zoox Robotaxis In Las Vegas And We Took A Ride","CNBC",10m 1s,https://www.youtube.com/watch?v=lIRW8bfy4kE&pp=0gcJCeAJAYcqIYzv
"TRAVEL LIKE A PRO! 25 ESSENTIAL Tips for VIETNAM in 2025","Travis Travels Vietnam",15m 15s,https://www.youtube.com/watch?v=KYCggx5kfnM
"Метеориты повсюду, и вот как их найти","Коллектив",25m 7s,https://www.youtube.com/watch?v=UpCHPokImNw
"Алла Пугачева - Робот (1965)","Sinemario",3m 15s,https://www.youtube.com/watch?v=xXlGQ91_frc&list=RDxXlGQ91_frc&start_radio=1&pp=oAcB
"Мальдивы | Почему они стали дешевле Турции? Сколько стоит отдых? Какие острова выбрать?","BumTV",10m 9s,https://www.youtube.com/watch?v=IWPm7eTx77g
"Реутов ТВ. Модный Диван. Серебряная Калоша 2010.","Pismoshnaya",8m 16s,https://www.youtube.com/watch?v=UijomnwVmFs
"Is Instagram ruining #Bali? | Foreign Correspondent","ABC News In-depth",29m 57s,https://www.youtube.com/watch?v=-emtuVSvds4
"North Korea's Secret ""Pleasure Squad"" Parties","DimpleVideo",8m 1s,https://www.youtube.com/watch?v=RtW93DTMrGM
"Обзор iPhone Air — испортили воздух","Rozetked",13m 6s,https://www.youtube.com/watch?v=B9oIps6Cb50&pp=ugUEEgJydQ%3D%3D
"Как Путин убивал Навального? Новые подробности страшного преступления","Алексей Навальный",15m 29s,https://www.youtube.com/watch?v=vSWJibAWFFQ
"StarCraft - Terran Theme 1","Katrulzin",4m 58s,https://www.youtube.com/watch?v=mD4GbGmvNRc&list=RDmD4GbGmvNRc&start_radio=1&pp=oAcB
"Убийца Vision Pro — Xreal One Pro в реальной жизни","BIG GEEK",19m 41s,https://www.youtube.com/watch?v=7ghQsoaPFWI
"3 года нелегально в Испании. Наша реальная история иммиграции. Переезд в Европу","оп оп живем",16m 11s,https://www.youtube.com/watch?v=wnjuQhabzTE
"Rob Dougan - Furious Angels","RobDouganVEVO",3m 59s,https://www.youtube.com/watch?v=jtAmFKaThNE&list=RDjtAmFKaThNE&start_radio=1&pp=oAcB
"Генеральские котлы, но это Half-Life","rootkieper",1m 54s,https://www.youtube.com/watch?v=vhgxxDy9YPI
"My Pattaya Addiction: Losing Myself in Paradise","Inside Thailand Stories",31m 43s,https://www.youtube.com/watch?v=ol344FNugO0
"Where I would retire today on $1000 month overseas","Vagabond Awake",21m 5s,https://www.youtube.com/watch?v=EHA_ZniLFv4
"Can't Take My Eyes off You","Frankie Valli and the Four Seasons - Topic",3m 24s,https://www.youtube.com/watch?v=DYwQy_9JPtQ&list=RDDYwQy_9JPtQ&start_radio=1&pp=oAcB
"What Being a Personal Trainer Taught Me About Women","Martel Metellus",20m 6s,https://www.youtube.com/watch?v=SD0pHXMDhiM&pp=ugUEEgJlbg%3D%3D
"Как заработать на Американском YouTube из Кыргызстана? / Опыт Asan DaDLine","АЛКАНОВ",1h 20m 49s,https://www.youtube.com/watch?v=b8B5JG5dgOg
"Честным быть выгодно, реклама Альфабанк","Добрый",2m,https://www.youtube.com/watch?v=Uhr1c4YY4sI&pp=0gcJCeAJAYcqIYzv
"Bossa Nova Covers 2025 – Chill Versions of Popular Songs","Simply Bossa",1h 30m 23s,https://www.youtube.com/watch?v=IuD38mqTRQ4&list=RDIuD38mqTRQ4&start_radio=1&pp=oAcB
"КАК ЖИВУТ БОГАТЫЕ КИТАЙЦЫ | КВАРТИРА ЗА $1,000,000 В КИТАЕ","Китаянка Лилия",15m 2s,https://www.youtube.com/watch?v=pl0pxKuvwRQ&pp=ugUEEgJydQ%3D%3D
"Chillout Productivity Music | Relaxing Beats for Deep Work & Study Flow in a Cozy Den","Mindful Deep Work",2h 11m,https://www.youtube.com/watch?v=QmDCRMsyORk&list=RDQmDCRMsyORk&start_radio=1&pp=oAcB
"Этот РОБОТ начинает РЕВОЛЮЦИЮ | РАЗБОР Figure","Droider",17m 2s,https://www.youtube.com/watch?v=HOqbOqNYiyw&t=520s
"黃明志千萬點閱神曲精選 @Playlist Pt1","Namewee",1h 55m 14s,https://www.youtube.com/watch?v=PUqkUzXEtuI&list=RDPUqkUzXEtuI&start_radio=1&pp=oAcB
"The Weirdest Things Happened on My Last Day in North Korea 🇰🇵","iGoBart",16m 27s,https://www.youtube.com/watch?v=GQT3XKBgBeg
"Основание Азимова: о чём книги и что изменили в сериале?","Космический Скиталец",7m 1s,https://www.youtube.com/watch?v=BOwdu_q3Q4o
"Villa-Lobos - Bachianas Brasileiras No.5 - performed by Andrew and Ben Keeling ","andrew keeling",5m 44s,https://www.youtube.com/watch?v=1xHSueJS-oM&list=RD1xHSueJS-oM&start_radio=1&pp=oAcB
"ALANYA GRAND BAZAAR 2024 I ALANYA  FAKE MARKET ANTALYA SHOPPING CENTER ! TURKEY HOLIDAY TRAVEL 4K","Alanya Trip tv",17m 4s,https://www.youtube.com/watch?v=A81nOfqMV5E&pp=0gcJCeAJAYcqIYzv
"Just the Two of Us (feat. Bill Withers)","Grover Washington, Jr. - Topic",7m 19s,https://www.youtube.com/watch?v=6POZlJAZsok&list=RD6POZlJAZsok&start_radio=1&pp=oAcB
"Married couple move to Thailand! - Inside their $430 month Condo","Sam Tyler ",36m 17s,https://www.youtube.com/watch?v=zRBIjSIizmk&pp=ugUHEgVlbi1HQtIHCQngCQGHKiGM7w%3D%3D
"Bossa Nova Jazz Cover Songs ☕Best Bossa Nova Relaxing Songs ☕New Bossa Nova Music 2024","Bossa Nova Jazz Music & TL",P0D,https://www.youtube.com/watch?v=oc7rkVTuNCY&pp=0gcJCeAJAYcqIYzv
"Our FIRST Time in Vietnam: SO CHEAP It Feels ILLEGAL!","Adam & Yaz",25m 34s,https://www.youtube.com/watch?v=owZaKB_cf98&pp=0gcJCeAJAYcqIYzv
"Bear McCreary - All Along The Watch Tower (With Cylon Intro)","SurfCompton",5m 45s,https://www.youtube.com/watch?v=BigolJfoANw&list=RDBigolJfoANw&start_radio=1&pp=oAcB
"Bangkok’s SECRET Foreign Speed Dating Club","Asian Women Official",5m 56s,https://www.youtube.com/watch?v=FADyFhV4yT4&pp=0gcJCeAJAYcqIYzv
"Science proves that ejaculating more often reduces your risk of CANCER?! A Urologist explains","Rena Malik, M.D.",7m 20s,https://www.youtube.com/watch?v=ZYhZMsvBWSU&pp=ugUEEgJlbtIHCQngCQGHKiGM7w%3D%3D
"Surviving Your First Night in Pattaya: A Degenerate’s Guide","Thai Life Chronicles",12m 26s,https://www.youtube.com/watch?v=aBh4vNLJnqw
"Virgins for sale in Colombia in 'world's biggest brothel'","Channel 4 News",11m 53s,https://www.youtube.com/watch?v=aAXOC3P0Knw
"Ex-PM Jailed, Gloomy Polls & Hotels Slash Prices - What's Happening in Thailand Now","Cal",4m 55s,https://www.youtube.com/watch?v=8Cn9wA_g1-w&pp=0gcJCeAJAYcqIYzv
"Scooter - Fire","Shamo",3m 14s,https://www.youtube.com/watch?v=RZ8D28gvkjc&list=RDRZ8D28gvkjc&start_radio=1&pp=oAcB
"MadeOn YouTube 2025 | Creator Roundup","YouTube Creators",4m 46s,https://www.youtube.com/watch?v=OJ0Eg9kT3QM
"My Way (2008 Remastered)","Frank Sinatra - Topic",4m 37s,https://www.youtube.com/watch?v=qQzdAsjWGPg&list=RDqQzdAsjWGPg&start_radio=1&pp=oAcB
"Renting a Girlfriend in the Philippines: happy endings and caregivers with benefits","Smart Girl Philippines",8m 13s,https://www.youtube.com/watch?v=R3aYVF3p-js&pp=ugUHEgVlbi1VUw%3D%3D
"Как TURKISH AIRLINES стала одной из САМЫХ ВЛИЯТЕЛЬНЫХ АВИАКОМПАНИЙ в мире?","Starflyerpilot | Всеволод Сафро",14m 41s,https://www.youtube.com/watch?v=6IR0IUPUrtM&pp=ugUEEgJydQ%3D%3D
"Why Men are Attracted to Asian Women| Elite Asian Matchmaker Ep 3","TwoAsianMatchmakers",11m 25s,https://www.youtube.com/watch?v=fosfL0uK7hI
"Why So Many Girls Love Bali Beaches","YASU Business Channel",19m 59s,https://www.youtube.com/watch?v=i0_zlcFZFMU
"Physicists are afraid of Eric Weinstein -- and they should be","Sabine Hossenfelder",12m 34s,https://www.youtube.com/watch?v=KiFYcuoK490&pp=ugUEEgJlbg%3D%3D
"Why you should NEVER retire in Da Nang, Vietnam. ","brokethehabit",19m 25s,https://www.youtube.com/watch?v=hW4E5Mk4DI0&pp=ugUHEgVlbi1HQtIHCQngCQGHKiGM7w%3D%3D
"$20 vs $1000 in Guangzhou, China! 🇨🇳","bread gang",38m 38s,https://www.youtube.com/watch?v=MF-Y18rQBFU&pp=ugUEEgJlbg%3D%3D
"ChatGPT Can Now Call the Cops, but 'Wait till 2100 for Full Job Impact' - Altman","AI Explained",11m 32s,https://www.youtube.com/watch?v=H4Qog494fl4&pp=ugUHEgVlbi1HQg%3D%3D
"Bossa Nova Covers 2025 – Calm Bossa Nova Jazz for Focus and Relaxation","Simply Bossa",3h 4m 13s,https://www.youtube.com/watch?v=3TZjm5EhuPE&list=RD3TZjm5EhuPE&start_radio=1&pp=oAcB
"Интервью с «СВО»-шниками | Что они говорят о войне (English subtitles) @Max_Katz","Максим Кац",20m 43s,https://www.youtube.com/watch?v=B_5rXGm5HFo
"Foreigner Met 100+ Thai Girls INSTANTLY","Asian Women Official",5m 7s,https://www.youtube.com/watch?v=ETF6x4HF5Dk
"Pros and Cons of Retiring in Da Nang, Vietnam @TravisTravelsVN","What The Pho ",23m 7s,https://www.youtube.com/watch?v=QriTdwboAJA
"$500–$650 Bangkok Condos Tour | Knightbridge Prime On Nut vs Aspire Sukhumvit","Grif Abroad",17m 31s,https://www.youtube.com/watch?v=e4krj1HcVt0
"НАБИУЛЛИНА БЬЕТ ТРЕВОГУ/ ОБВАЛ ОТРАСЛЕЙ/ ДЕФИЦИТ БЕНЗИНА НАРАСТАЕТ/ ДЕНЕГ НЕ ХВАТАЕТ. Милов","Майкл Наки",1h 1m 23s,https://www.youtube.com/watch?v=kYV2F23hRCs
"Мой «переезд» в Тайланд. Выход в отставку. Поиск квартиры. Виза. Счет в банке… делать продолжение?","Gera Sheriff",33m 14s,https://www.youtube.com/watch?v=IaVtKZJ3GOE
"Результаты встречи на Аляске — перемирия не будет, война продолжается (English subtitles) @Max_Katz ","Максим Кац",15m 23s,https://www.youtube.com/watch?v=VmMjZpS_yBs
"10 BEST Small Towns & Cities to Retire in Asia Right Now!","Evan Eh! 🇨🇦",21m 42s,https://www.youtube.com/watch?v=oBddOOGsZts&pp=ugUHEgVlbi1VUw%3D%3D
"""МОЖНО ТЕБЯ ЗАБРАТЬ В ОТЕЛЬ?"" - но камбоджийка отказалась. Почему? / CAMBODIA","ПЛАНЕТКА",39m 32s,https://www.youtube.com/watch?v=MPMzMnxzdz0
"The Harsh Truth Behind Thailand's Tourism Collapse","keis one",13m 36s,https://www.youtube.com/watch?v=NscBEwh0FmA&pp=ugUEEgJlbg%3D%3D
"Before You Touch a Freelancer in Pattaya… Watch This (2025)","Real Talk Thailand",8m 24s,https://www.youtube.com/watch?v=QOfQ07ltLK0
"Как Китайцы Др***т на Россию I Русская Жена и Китайский Национализм","SHANKANAKA",17m 49s,https://www.youtube.com/watch?v=zvQDcjGYJq0
"Сингапур: город-тюрьма в самой счастливой стране | Тысячи долларов за голубей, питбулей и жвачку","Varlamov Travel",51m 55s,https://www.youtube.com/watch?v=SeNxRTmMSsw
"Чем отравили Навального? Как сажают вернувшихся россиян. Газманов отдал все накопления мошеннику","Телеканал Дождь",1h 8m 16s,https://www.youtube.com/watch?v=Nv0j_96vEeY
"""Это аморально"", - Дмитрий Потапенко - о возможном ужесточении правил выдачи виз для россиян","DW на русском",9m 8s,https://www.youtube.com/watch?v=3nb_wOwxsx4
"I Bought Vietnam’s Biggest Scams (so you don’t have to)","David Khai",44m,https://www.youtube.com/watch?v=Dizi_bTC0Gw&pp=0gcJCeAJAYcqIYzv
"Ядерная принцесса Северной Кореи. Ким Ё Чжон","Камера Обскура",19m 1s,https://www.youtube.com/watch?v=yZdM7MB7Y4w
"I Got KICKED OUT Of My PENTHOUSE! 😭","Shu",41m 49s,https://www.youtube.com/watch?v=ber7uX5-X5c
"КНДР глазами россиян: не все так плохо? | Ланьков о законах, стране чухче, Ким Чен Ыне и слежке","varlamov",1h 19m 16s,https://www.youtube.com/watch?v=Xn7eXzwt6fs&pp=0gcJCeAJAYcqIYzv
"Вахштайн: Звёзды Голливуда против Израиля – разрешённый антисемитизм?","The Breakfast Show",25m 23s,https://www.youtube.com/watch?v=AoruF-D9H1U
"How to Receive Verification Codes Overseas (Like Bank SMS Texts)","Project Untethered",5m 5s,https://www.youtube.com/watch?v=Sq3WlvFaP8M
"Самуи - Тайские Мальдивы! Забудьте про Пхукет…","Expat Life",46m 52s,https://www.youtube.com/watch?v=1LnzNuXwIZU&pp=ugUEEgJydQ%3D%3D
"Разоблачение Анатолия Сульянова: ""Я не при делах"" за $7,000,000!","Олег Артемьев - Ленивый инвестор",39m 32s,https://www.youtube.com/watch?v=XjEdvxrAxOY
"The App Store is Now Pay-to-Play","Adam Lyttle",7m 11s,https://www.youtube.com/watch?v=Qs0i779s7go&pp=ugUHEgVlbi1BVQ%3D%3D
"Как кофе меняет микрофлору и защищает от болезней #кофе #микрофлора","Доктор Вялов",17m 52s,https://www.youtube.com/watch?v=e1Uc59K8ms8
"Бывший разработчик Amazon ищет работу в Нью-Йорке | Секрет успеха в Big Tech в 2025","Victoria Borodina",53m 20s,https://www.youtube.com/watch?v=355ZZdofA5s&pp=ugUEEgJydQ%3D%3D
"New Crypto Bill Will “Unleash Chaos,” Warns Economist | Amanpour and Company","Amanpour and Company",17m 29s,https://www.youtube.com/watch?v=4au8FGg3Qvg
