Title,Channel,Duration,URL
"СЕВЕРНЫЙ КИПР: рай для нудистов. Так ли здесь круто, как нам не рассказывают? / 1 серия","ПЛАНЕТКА",21m 28s,https://www.youtube.com/watch?v=4pIJ9aLpCHg
"New York State Prisons: How to Avoid Rape in Prison - Men's Orientation","The Marshall Project",23m 50s,https://www.youtube.com/watch?v=8zYBmsP6fes&t=1143s
"Live Like a King in Bangkok: Luxury Living in Thailand 🇹🇭","Nomad Capitalist",54m 10s,https://www.youtube.com/watch?v=B3MEPUFeC1s
"Why the US & China both Need Vietnam","Aaron Watson ",13m 35s,https://www.youtube.com/watch?v=hBprIviM6hE&pp=ugUEEgJlbtIHCQnKCQGHKiGM7w%3D%3D
"Energy Project - Jump 2 Dance","Energy Project [Electro Freestyle Music]",2m 55s,https://www.youtube.com/watch?v=725VY54Scfk&list=RD725VY54Scfk&start_radio=1&pp=oAcB
"THE HISTORY OF THE PHILIPPINES in 12 minutes (OLD VIDEO)","Knowledgia",12m 8s,https://www.youtube.com/watch?v=P-I4Bay5SXo&list=PLOJtsUMWwR9jjDnwfksOywYbgBeCQy58e
"The Best 0% Tax Strategy for Digital Nomads in 2025","Joose the Nomad",7m 8s,https://www.youtube.com/watch?v=XOy82NUYBUQ
"I Ate NO Food for 7 Days, Here’s What Happened","Justin Dorff",11m 30s,https://www.youtube.com/watch?v=GsorY2ZRvEA&pp=ugUEEgJlbg%3D%3D
"Алла Пугачёва - Арлекино (Official HD Video)","Алла Пугачёва",4m 41s,https://www.youtube.com/watch?v=itzde0VrzFU&list=RDitzde0VrzFU&start_radio=1&pp=oAcB
"Apes Freaked Out When I Spoke Their Language","Xiaomanyc 小马在纽约",14m 33s,https://www.youtube.com/watch?v=drEfteACl-E
"1945: Капитуляция Японии / Как закончилась Вторая мировая война / Уроки истории / МИНАЕВ","МИНАЕВ LIVE",55m 51s,https://www.youtube.com/watch?v=sttzBzuEktA&list=PLosWRcTJZf2rOxbZAer-9zWvdosM4VRsq
"Как новые версии iOS влияют на батарейку и производительность?","Rozetked",15m 42s,https://www.youtube.com/watch?v=vsrg_Q0PzTM&t=212s&pp=ugUEEgJydQ%3D%3D
"⚡️НОВОСТИ | ПУТИН НА УЧЕНИЯХ «ЗАПАД-2025» | РОССИЯНЕ СКУПАЮТ Б/У МОБИЛЬНЫЕ | ПОЖАР В ДОМЕ ГУЗЕЕВОЙ","Ходорковский LIVE",11m 9s,https://www.youtube.com/watch?v=2l3oALS6Dnc
"🇸🇬🇰🇷Yishun Dam–Singapore’s Hidden Gem? A Korean Family’s Off-the-Beaten-Path Experience [SG2EP8]","Doonk Family",16m 3s,https://www.youtube.com/watch?v=Iu-zzra-CTU&pp=ugUHEgVlbi1VUw%3D%3D
"Singapore’s multi-millionaire on China, America and AI","Max Chernov",1h 15m,https://www.youtube.com/watch?v=5tP7QksbJVQ
"Rock found on Mars could be evidence of ancient life, NASA says","ABC News",4m 58s,https://www.youtube.com/watch?v=sIUqvXSSAxw
"Tips on Attracting a Chinese Woman","Dating Beyond Borders",9m 32s,https://www.youtube.com/watch?v=86X4HzGbfYQ
"Булгаков / Зависимость, мистика и Сталин в жизни Мастера / ЛИЧНОСТИ / @MINAEVLIVE","МИНАЕВ LIVE",54m 56s,https://www.youtube.com/watch?v=hMIFmrH6GPs&list=PLosWRcTJZf2pdMiXf_q0CSgjmxDl81sk7
"Почему Дэвид Предал Человечество? Настоящее объяснение от Ридли Скотта  #чужой #прометей #завет","ShadowTavern",8m 42s,https://www.youtube.com/watch?v=Hi5wPTp9Jzw&pp=ugUEEgJydQ%3D%3D
"A Single Woman and 32 Men Stranded on an Island - The Queen of Anatahan","Kenji Pictures",11m,https://www.youtube.com/watch?v=YLLUeedhJEg&t=352s
"Marriage in Vietnam Becomes Foreigner’s WORST NIGHTMARE! (it’s INSANE!)","Duong Global Business Consulting Group",16m 55s,https://www.youtube.com/watch?v=xTh_CXB1cyo&pp=ugUHEgVlbi1VUw%3D%3D
"Why are Foreigners Leaving Japan?","Oriental Pearl",19m 57s,https://www.youtube.com/watch?v=tG02cfXToJE
"K2, Пик Победы и трагедия Натальи Наговицыной — интервью с Эдуардом Кубатовым","Максим Полетаев ",50m 4s,https://www.youtube.com/watch?v=tbkUdyrL4jA
"How he lives on $500/mo and restarted his life in Da Nang, Vietnam","brokethehabit",21m 59s,https://www.youtube.com/watch?v=FhAuKdQUfDI&pp=ugUHEgVlbi1HQg%3D%3D
"Гемангиома позвоночника","Московские центры В.И. Дикуль",2m 44s,https://www.youtube.com/watch?v=zvwjf7EYBUo
"В.Жириновский - Как будет проходить третья мировая война","My Capital",5m 31s,https://www.youtube.com/watch?v=5hLToBNY1YY
"""American Veteran In Russia Alone at Night | AM I SAFE?","American Sputnik ",13m,https://www.youtube.com/watch?v=Kj6_pLA5txw
"Matthew McConaughey's Concerns Over AI","JRE Clips",15m 27s,https://www.youtube.com/watch?v=z_bX3runikk
"The Smart Home | Luxury 3 & 4BHK House for Sale in Coimbatore - Casagrand Villas | Epi-234","Tamil Veedu",19m 21s,https://www.youtube.com/watch?v=iONkfdri2lQ
"Neuralink Update, Summer 2025","Neuralink",59m 59s,https://www.youtube.com/watch?v=FASMejN_5gs&pp=ugUHEgVlbi1VUw%3D%3D
"""ДЕВОЧКА-СКАНДАЛ"" С ОСТРОВА НОСИ БЕ / МАДАГАСКАР / Nosy Be - Антананариву /","ПЛАНЕТКА",38m 56s,https://www.youtube.com/watch?v=SylqO6x_dYc
"СПАС МУСУЛЬМАНКУ ОТ ТОРГОВЛИ СОБОЙ / остров Мадагаскар / 3 СЕРИЯ","ПЛАНЕТКА",46m 34s,https://www.youtube.com/watch?v=CdQGQMsA4jk
"СЕКС НА КУБЕ / на что эта мулатка готова ради айфона? / ДРУГАЯ ЖИЗНЬ ГАВАНЫ","ПЛАНЕТКА",43m 14s,https://www.youtube.com/watch?v=h2qdU50aotk&t=10s
"4,500,000 THB ($129,000) Mountain View Condo for Sale in Chiang Mai, Thailand","Farang Homes",19m 37s,https://www.youtube.com/watch?v=fzBwhlp_t9w
"ФИЛИППИНЫ - рай для ""папиков"", виагра, walking street / angeles city","ПЛАНЕТКА",29m,https://www.youtube.com/watch?v=HZwq34Rvea4
"ЗАНЗИБАР / женские драки за белых парней / Nungwi Zanzibar","ПЛАНЕТКА",27m 54s,https://www.youtube.com/watch?v=SXrY3zYnaPI
"Бангкок без фильтров: гид показывает Варламову Азию | Интересные факты о Таиланде","Varlamov Travel",58m 16s,https://www.youtube.com/watch?v=ZEILm0J8lo0&pp=0gcJCcoJAYcqIYzv
"КЫРГЫЗСТАН: новый ""дом"" для русских / горы мяса, драки в клубах и культ Иссык-куля / PLANETKA","ПЛАНЕТКА",52m 45s,https://www.youtube.com/watch?v=zuGzNUwdPCU
"ЕГИПЕТ ДЛЯ РУССКИХ / что вы теряете на пляжах Хургады и Шарм-эль-Шейха / Cairo Egypt","ПЛАНЕТКА",51m 22s,https://www.youtube.com/watch?v=ZJ8RBHOi7hI&t=1536s
"ФИЛИППИНЫ: девушка влюбилась и повела знакомиться с семьей / ANGELES PHILIPPINES","ПЛАНЕТКА",34m 50s,https://www.youtube.com/watch?v=MSs5uxZH6x4
"КОТ-Д'ИВУАР: секс, растаманы и лакшери/ от культа Дрогба до культа Путина","ПЛАНЕТКА",38m 47s,https://www.youtube.com/watch?v=1tna5V75U20
"НЕ ДАЮЩИЕ КРАСОТКИ / Венесуэла и ее пляжный отдых","ПЛАНЕТКА",36m 20s,https://www.youtube.com/watch?v=0J40m8ZsRes&t=1113s
"3,790,000 THB ($104,000) Brand New Duplex Condo in Bangkok, Thailand","Farang Homes",8m 31s,https://www.youtube.com/watch?v=C3CpIr5s6Dc&t=3s
"AI News: Claude Takes Over Office, ByteDance Goes After Google","Matt Wolfe",38m 9s,https://www.youtube.com/watch?v=BnXDMET-b74&pp=ugUEEgJlbg%3D%3D
"I Left The U.S. For Thailand — Look Inside My $544/Month Apartment","CNBC Make It",8m 39s,https://www.youtube.com/watch?v=NauQ6h76X8s
"Are Tourists Ruining Thailand? (The Ugly Truth)","Sam Tyler ",7m 48s,https://www.youtube.com/watch?v=4Nh_JtC1dQs&pp=ugUHEgVlbi1HQg%3D%3D
"КАНАРЫ / когда секс - это религия / Латиносы, их нравы и ""новый русский"" рай 90-х","ПЛАНЕТКА",44m 6s,https://www.youtube.com/watch?v=xaqwEIccbfs&t=1011s
"7-Eleven Survival Phrases Every Expat Should Know","Thai For Beginners",5m 28s,https://www.youtube.com/watch?v=tMXksOIY6NU&pp=0gcJCcoJAYcqIYzv
"How We Built It: $900K Open Source SaaS","Starter Story",14m 37s,https://www.youtube.com/watch?v=F8i0kkrQ8_o&pp=ugUHEgVlbi1VUw%3D%3D
"СТРАНА САМЫХ СТРЁМНЫХ ЖЕНЩИН / Камерун, Африка","ПЛАНЕТКА",34m 12s,https://www.youtube.com/watch?v=QSqe99zsXaA
"21 Things I Wish I Knew Before Visiting Thailand 🇹🇭","Destination Well Known",15m 5s,https://www.youtube.com/watch?v=PciRGU5d_SI&pp=ugUEEgJlbg%3D%3D
"Living WELL on $1000/month in World's CHEAPEST Country (Da Nang, Vietnam)","Joose the Nomad",13m 16s,https://www.youtube.com/watch?v=KZDgeLqySDg
"Trump's Military Ads VS. Biden's","TheDC Shorts",3m 1s,https://www.youtube.com/watch?v=m4Ic6Ox9nl4
"Деконструкция. Клим Жуков о польском историческом фильме «Крестоносцы» (1960)","Кино-Театр.Ру",1h 32m 6s,https://www.youtube.com/watch?v=5H5Z68Z4bs0&t=3s
"Sen. Fetterman: Extreme labels are 'cheapening our language'","Fox News",12m 46s,https://www.youtube.com/watch?v=I-djA41Meu0
"Китай для новичков: 7 вещей, которые нельзя делать иностранцам","Китайский язык с Фаиной Ли",8m 3s,https://www.youtube.com/watch?v=KehJFetyXHs
"Нейробиолог: Как не отупеть к 50 годам. Связь слабоумия и привычек | Владимир Алипов","Подкаст Алексея Голубева",1h 23m 47s,https://www.youtube.com/watch?v=TprZ-83fAiE&t=206s
"10 вещей, которые меня удивили во Вьетнаме","Екатерина Таскинова",23m 30s,https://www.youtube.com/watch?v=pB_IO6FqEaE
"Станислав Белковский. Дроны в Польше. Саммит ШОС. Интервью Пугачевой","Yulia Latynina",59m,https://www.youtube.com/watch?v=PPxpfefowxQ&pp=0gcJCcoJAYcqIYzv
"🇲🇾| 3rd MOST DANGEROUS City In SOUTH EAST ASIA - Street Interviews in KL","Chai Travel",13m 8s,https://www.youtube.com/watch?v=dhMkQFmpjHs&pp=ugUEEgJlbg%3D%3D
"Phuket Is Not The Same in 2025: What's it like now | Josh On The Move","Josh On The Move",11m 45s,https://www.youtube.com/watch?v=PsYC75bxdUc&pp=ugUEEgJlbg%3D%3D
"Comedy Club: Виктор Криптовалютов | Алексей Шальнов  @TNT_television","ТНТ",8m 44s,https://www.youtube.com/watch?v=Vv51jW2Dga0
"🇯🇵 Русскоговорящий Японец ХАФУ о том Какого Это расти среди Японцев будучи Наполовину 🇷🇺 Русским в🇯🇵","Interview Japan",12m 1s,https://www.youtube.com/watch?v=_w5x_CeEkVA&pp=ugUEEgJydQ%3D%3D
"THIS Is The Fastest Way To Get Dementia… |  The Brain Doctor, Dr Ann Mckee","The Diary Of A CEO Clips",8m 30s,https://www.youtube.com/watch?v=aOW_HslF5ko&pp=ugUEEgJlbtIHCQnKCQGHKiGM7w%3D%3D
"Таиланд: НОВЫЕ ПРАВИЛА ВЪЕЗДА! Как правильно заполнить TDAC?","Elena Morozova Vlog Thailand",14m 33s,https://www.youtube.com/watch?v=hecDRa5PfiE
"Is This KL’s Best Condo? 🏙️ Inside ParkPlace @ Desa ParkCity!","Above & Beyond Estates By Kelvin",27m 20s,https://www.youtube.com/watch?v=O0lbuV2PGdE
"What I Learned Approaching 10,000 Women","Benjamin Seda",20m 1s,https://www.youtube.com/watch?v=tI-0ieWghxQ
"What $49,000 Buys You in Melaka MALAYSIA (so peaceful!)","Jack Alderton",9m 18s,https://www.youtube.com/watch?v=H5ZK8tGAvEk&pp=ugUHEgVlbi1VUw%3D%3D
"Why are so many expats leaving Thailand?","Sam Tyler ",8m 34s,https://www.youtube.com/watch?v=RjoF2jxgCFo&pp=ugUHEgVlbi1HQg%3D%3D
"Visa & Entry Rules for Thailand in 2025: What Visitors and Expats Need to Know","Cal",8m 34s,https://www.youtube.com/watch?v=tg3WPnqjXuY
"Максим Галкин  - Про нищую Россию","Максим Галкин. Без цензуры",9m 12s,https://www.youtube.com/watch?v=4Eg1bW32xCU
"The Worst Mount Everest Deaths in Human History","Simple Paint",15m 58s,https://www.youtube.com/watch?v=2XOD4b5uwfg&pp=0gcJCcoJAYcqIYzv
"Владимир Путин лично сообщил подполковнику Александру Данилову о присвоении звания Героя России","Diplomatrutube",4m 1s,https://www.youtube.com/watch?v=afKP4iNDOIA
"Обзор Xreal One и One Pro","Rozetked",16m 29s,https://www.youtube.com/watch?v=x1kuQO2iK8M&t=14s&pp=ugUEEgJydQ%3D%3D
"1 минута драки = 3 года тюрьмы. Главный прием, чтобы не стать виновным, даже при самообороне.","Корнев и Партнёры",16m 31s,https://www.youtube.com/watch?v=qnM7gc6RnAg
"Вышла iOS 26 - ПОЛНЫЙ ОБЗОР","Romancev768",12m 51s,https://www.youtube.com/watch?v=gRCVlqw0x9s
"РЕДКИЙ ДИАГНОЗ - ПОСЛЕДНИЙ ГОД ЖИЗНИ","Aaron Levi",16m 49s,https://www.youtube.com/watch?v=gE7BE1RPF00&pp=ugUEEgJydQ%3D%3D
"Sam Altman on God, Elon Musk and the Mysterious Death of His Former Employee","Tucker Carlson",57m 10s,https://www.youtube.com/watch?v=5KmpT-BoVf4&pp=ugUEEgJyddIHCQnKCQGHKiGM7w%3D%3D
"This Is Why People Fear The Mossad | Former CIA Officer John Kiriakou","Dalton Fischer Podcast",12m 42s,https://www.youtube.com/watch?v=2T5c5REOlyM&pp=ugUEEgJlbg%3D%3D
"Can You Keep Up With A Younger Woman In The Philippines?","The Filipina Pea",15m 59s,https://www.youtube.com/watch?v=9d3Mj22pWEI&pp=ugUHEgVlbi1VUw%3D%3D
"Путин сваливает проблемы в экономике на министров. Кадыров против Пугачевой. Пожары в Москве| ВОЗДУХ","Ходорковский LIVE",27m 23s,https://www.youtube.com/watch?v=Bf0T0hy8vtU
"Vietnam VS Thailand! ✅ True opinions From Foreign Tourists","Chai Travel",16m 57s,https://www.youtube.com/watch?v=ehr_YQFOyp4
"Asking Digital Nomads What They Do For A Living (Bali, Indonesia)","Charlie Chang",21m 19s,https://www.youtube.com/watch?v=kUbZmTWXQp8
"Elon Musk shares 'tentative' Mars game plan in SpaceX update at Starbase","VideoFromSpace",8m 50s,https://www.youtube.com/watch?v=-HojSvdYYCs
"How Much Is RICH In Thailand? Let's Ask Thai Girls","Geofrey Peterson",17m 22s,https://www.youtube.com/watch?v=r2yRWePLfMM
"Asking Amsterdam: How much do you make?","David Wen",13m 5s,https://www.youtube.com/watch?v=SvDRhXyIwzc&pp=ugUHEgVlbi1VUw%3D%3D
"Глазами фехтовальщика: Артур Дейн против Неда Старка","SwordMasters",18m 12s,https://www.youtube.com/watch?v=KcAGXpXw41M
"Разоблачение 7 ГЛАВНЫХ МИФОВ о витаминах, коже и питании! Ученый Александр Панчин ","Максим Кузнецов",1h 12m 8s,https://www.youtube.com/watch?v=6Wu8YUoIYfQ
"Государственное Инфоцыганство// Темная Сторона Традиционной Китайской Медицины","SHANKANAKA",13m 14s,https://www.youtube.com/watch?v=jaaU4ZCifcs
"""There's A Playbook!"" - Charlie Kirk on How to Get RICH","The Iced Coffee Hour Clips",11m 58s,https://www.youtube.com/watch?v=g3QLUChcXoU
"🔥RAE LIL BLACK on Living in Bangkok, Dating Life, Movie Career & More | One Night in Bangkok Ep. 026","One Night in Bangkok",58m 42s,https://www.youtube.com/watch?v=xrm22Lb8xAQ
"What I Wish Everyone Knew About Cancer","Cleo Abram",12m 37s,https://www.youtube.com/watch?v=USmu0scNcSs&pp=ugUEEgJlbg%3D%3D
"Retired Early in Da Nang Vietnam: American Veteran Didn't Wait for Social Security!","The Cost of Living Abroad",1h 1m 9s,https://www.youtube.com/watch?v=P6EEOHPWNYc
"China's Mistress Village Is Crazy","Asmongold TV  ",23m 2s,https://www.youtube.com/watch?v=E9Jxd76jYi0
"""Кругом одно г*вно, все мужики на СВО!"" Как живет первое в РФ село воинской славы","Denis Kazanskyi",13m 29s,https://www.youtube.com/watch?v=KgZTESx-GjU&pp=0gcJCcoJAYcqIYzv
"I'm 45. If you're in your 30s watch this:","Dan Go",21m 11s,https://www.youtube.com/watch?v=utEnwV1WFlw&pp=ugUEEgJlbg%3D%3D
"Sex Expert (Esther Perel): The Relationship Crisis No One Talks About That's Killing Your Sex Life!","The Diary Of A CEO",1h 28m 22s,https://www.youtube.com/watch?v=QCaFWrT0j-g&pp=ugUEEgJlbg%3D%3D
"DONT be a Digital Nomad Until You Watch This (Brutally Honest Reality)","David & Kim",16m,https://www.youtube.com/watch?v=-XANgmgylyE
"Гей-пенсионер совращает соседа","Уфимское Времечко",2m 39s,https://www.youtube.com/watch?v=_XejvqlCFHs
"Марш ярости: Засуньте свою Палестину себе в $#*@%!!! Британия сказала НЕТ исламизации","Сергей Ауслендер",20m 53s,https://www.youtube.com/watch?v=Fc5fa0-o1Lc&pp=ugUEEgJydQ%3D%3D
"$30B Founder: How To Rank #1 In ChatGPT","My First Million",1h 9m 18s,https://www.youtube.com/watch?v=0a-o9DZumjE&pp=0gcJCcoJAYcqIYzv
"Key moments at House UFO transparency hearing","CBS News",1h 18m 45s,https://www.youtube.com/watch?v=Y0Sjv30bCio
"ХОДОРКОВСКИЙ против ПАСТУХОВА: Это паника. Европа растеряна. Зачем Трампу Лондон. Угроза Путина","Ходорковский LIVE",52m 44s,https://www.youtube.com/watch?v=af4aO1g19C8
"Avoid These 9 Tourist SCAMS In Italy!","Naick & Kim",10m 24s,https://www.youtube.com/watch?v=gkFRfuU4p7g&pp=ugUEEgJlbg%3D%3D
"macOS Tahoe (26) is AMAZING! Do these 10 things FIRST!","Proper Honest Tech",16m 37s,https://www.youtube.com/watch?v=kAlAIOum0JA&pp=ugUHEgVlbi1HQg%3D%3D
"$1.5B AI Founder: The Brutal Truth About AI Replacing Jobs","Silicon Valley Girl",25m 45s,https://www.youtube.com/watch?v=UJo_MiMA7qE
"Why were the Japanese So Brutal In WWII?","Simple History",10m 48s,https://www.youtube.com/watch?v=LRyLl-gTwL4&pp=ugUHEgVlbi1HQg%3D%3D
"OpenAI’s New GPT-5 Codex Model — First Impressions","Matt Maher",14m 45s,https://www.youtube.com/watch?v=Jm7o5oJIJUQ
"Sasha Nezlobin: ""MY KID THINKS WE ARE POOR"" | RU Subs","Незлобин",5m 6s,https://www.youtube.com/watch?v=UdiMxEP6r6E
"$3000 Thai Hair Transplant!! Was This a Mistake??","More Best Ever Food Review Show",10m 53s,https://www.youtube.com/watch?v=Te0-_ooibbM
"Лучший поступок Джейме Ланистера","Films and books",13m 59s,https://www.youtube.com/watch?v=RizA7TIRjkw
"eBay & Etsy Just Got CRUSHED By Trump...And It’s GREAT News For YOU","MyWifeQuitHerJob Ecommerce Channel",12m 33s,https://www.youtube.com/watch?v=jXFt9Saargg&pp=ugUEEgJlbg%3D%3D
"I built an AI supercomputer with 5 Mac Studios","NetworkChuck",34m 57s,https://www.youtube.com/watch?v=Ju0ndy2kwlw&pp=ugUEEgJlbg%3D%3D
"❗️ИМПОРТ ЗАКРЫВАЮТ❗️Утильсбор для авто свыше 160лс теперь на запредельном уровне","Спец Авто Трейд ",11m 15s,https://www.youtube.com/watch?v=1V9YCOZuoJI
"Hiring an Escort in Japan","The Japan Reporter",10m 2s,https://www.youtube.com/watch?v=jfTLkLYyqW8
"ЭВОЛЮЦИЯ ВЗЯТОЧНИКА","ГвоздиShow",4m 28s,https://www.youtube.com/watch?v=S8QXZKXxZnM
"Весь Сюжет «War Within» за 13 Минут","Лунный Монах",13m 47s,https://www.youtube.com/watch?v=jN-WhpE0lO8&pp=ugUEEgJydQ%3D%3D
"Hua Hin Trip, Too Many Foreigners in Thailand, and Finding a Job in Bangkok | ONIB Ep. 043","One Night in Bangkok",52m 8s,https://www.youtube.com/watch?v=8PJEO_OnOKA
"GitHub's Free Tool Ends AI Coding Chaos (Demo Inside)","Sean Kochel",14m 18s,https://www.youtube.com/watch?v=KRWQTF0iAdM&pp=ugUEEgJlbtIHCQnKCQGHKiGM7w%3D%3D
"Fully autonomous robots are much closer than you think – Sergey Levine","Dwarkesh Patel",1h 28m 29s,https://www.youtube.com/watch?v=48pxVdmkMIE
"Алла Пугачева ""Песня первоклассника"" (1978)","Музыка на советском телевидении",2m 38s,https://www.youtube.com/watch?v=KLwyDo1Wo40&list=RDKLwyDo1Wo40&start_radio=1&pp=oAcB
"Vietnam Visa Guide - Online Application Walkthrough 2024","Travis Travels Vietnam",14m 8s,https://www.youtube.com/watch?v=qqEhF2SwaZo&pp=0gcJCcoJAYcqIYzv
"Ray-Ban Meta Smart Glasses 1 YEAR LATER","Ryan Osmond",20m 52s,https://www.youtube.com/watch?v=CJqVbuY563Q&pp=ugUEEgJlbg%3D%3D
"What’s it like to grow up and live in Lisbon, Portugal? | Young and European","DW Euromaxx",8m 37s,https://www.youtube.com/watch?v=aG73lCM8RII
"Why he left his job, sold everything, and moved to Vietnam.","brokethehabit",30m 59s,https://www.youtube.com/watch?v=-W3Bn3fwjsw
"Tech Industry Is Cooked So What Now","CodingPhase",20m 39s,https://www.youtube.com/watch?v=p5grOUgs_io&pp=ugUHEgVlbi1VUw%3D%3D
"Дерзкое ограбление Алексея Толстого | Откуда у семьи советского писателя несметные богатства","Центральное Телевидение",39m 2s,https://www.youtube.com/watch?v=IWc7V5E5u3Q
"How Marketers Create Billion Dollar Trends","Valuetainment",47m 30s,https://www.youtube.com/watch?v=maako3FhPCg
"Darth Vader CONFRONTS Darth Maul","Star Wars Kingdom",3m 11s,https://www.youtube.com/watch?v=6sTeVhoUVI0
"“Of Boys and Men:” Why the Modern Male Is Struggling | Amanpour and Company","Amanpour and Company",17m 45s,https://www.youtube.com/watch?v=kLBHUC90UFg
"I Was Ready To Quit Everything After One Week Here","Nomad Push",22m 25s,https://www.youtube.com/watch?v=7QOkItoFStk&pp=ugUEEgJlbg%3D%3D
"🇲🇾 Kuala Lumpur 1:00 AM Nightlife District | Best Nightlife In Asia","Travel with Dante",9m 37s,https://www.youtube.com/watch?v=Ag6PWVF9RWk
"Получил Серебряную кнопку YouTube","Михаил Непомнящий",2m 6s,https://www.youtube.com/watch?v=ws3okhhKGgo&pp=ugUEEgJydQ%3D%3D
"«Борец за нравственность» нарвался на чемпионку UFC | Скандал в Челябинске","ЛенТВ24",4m 2s,https://www.youtube.com/watch?v=dRlBR72Xzyk
"RAMAZAN HOCA'dan GENÇLERE TAVSİYELER! RAMAZAN HOCA İLE YEMEK SOHBETİMİZ!","YEMEK BİZDEN",20m 5s,https://www.youtube.com/watch?v=jmOL3AjDStw
"Samin Nosrat's Favorite Places to Eat in San Francisco | Where the Chefs Eat | Condé Nast Traveler","Condé Nast Traveler",16m 45s,https://www.youtube.com/watch?v=rdTo0m2_zhU
"Russia Deploys ISKANDERS in Kaliningrad... Poland PREPARES for WAR","The Military Show",18m 49s,https://www.youtube.com/watch?v=bUJiunuepSg&pp=ugUEEgJlbg%3D%3D
"Retired  Couple Scouting Bangkok: Airbnb Condo Tour $219: Rooftop Pool & Skyline Views Near","Pat & Rocky Travel",9m 1s,https://www.youtube.com/watch?v=wvJM3Y8v1bY
"Эхо камера - когда заключенные в XXI веке все до единого. Усиленные когнитивные искажения.","FreshLife28",19m 31s,https://www.youtube.com/watch?v=AECAHN1AYxw&pp=ugUEEgJydQ%3D%3D
"StarCraft 2 (RuFF Highlight): Mech Ferry","RuFF STuFF",9m 32s,https://www.youtube.com/watch?v=X0v5nTI5Q-k
"XREAL One Pro Review: The BEST 171"" AR Display Yet","Cas and Chary XR",16m 11s,https://www.youtube.com/watch?v=M2o-3UOhq3Q&pp=ugUHEgVlbi1VUw%3D%3D
"Why foreigners fell in love with Nanjing, China","Lisas_channel",3m 36s,https://www.youtube.com/watch?v=mzc0aw1_MOE
"Раскол американского общества | Украина — перед финансовой пропастью","Кофе с Любарским",1h 19m 11s,https://www.youtube.com/watch?v=wXlXAAES46E
"Александр Морозов*. 2024 / 20.12.24","Живой Гвоздь",50m 45s,https://www.youtube.com/watch?v=_DlIJOKYP2A
"I Tried Bodybuilding In Iceland- Not What I Expected!","Renaissance Periodization",17m 16s,https://www.youtube.com/watch?v=SHKtS32yAUs&pp=ugUHEgVlbi1VU9IHCQnKCQGHKiGM7w%3D%3D
"Can Foreigners Ride Motorbikes in Vietnam LEGALLY?","Rentabike Vietnam",6m 39s,https://www.youtube.com/watch?v=Txk84xYScvk
"Единый ВНЖ в Европе с 2026 года: работа и иммиграция в Европу станет проще?","Простая Германия",5m 14s,https://www.youtube.com/watch?v=IYzHit7WJco&pp=ugUEEgJydQ%3D%3D
"Клиента КИНУЛИ на 25000 рублей! Фейковый Ryzen 7 5800X3D с Авито! 🤬😱","Daniil Gerasimov",21m 40s,https://www.youtube.com/watch?v=_QCBJZXAaHs
"No One in China Can Own a Home - Chinese Government Takes Away Land - Episode #212","The China Show",1h 43m 12s,https://www.youtube.com/watch?v=rkLM0QjEeBU
"90년대 최고의 퀄리티! / 30년이 지나도 최고라고 평가 받는 이유 / 전설을 만든 천재들의 이야기! / 마크로스 플러스 숨겨진 이야기! / 마크로스 플러스","수상한아재",13m 21s,https://www.youtube.com/watch?v=9Z3y7GP2dKc
"Юлия Латынина /Как и откуда летят путинские ракеты/Фабрика Новин","Yulia Latynina",33m 48s,https://www.youtube.com/watch?v=4Qbu3pH6gAA&list=PLFCc7vDsPVrilV6pb07rMObZJhMHMmWq5
"People Are Underwhelmed With Charlie Kirk Shooter Investigation So Far... What Doesn't Add Up To Me","An0maly - News Analysis & Hip-hop",3h 56m 3s,https://www.youtube.com/watch?v=ZtDcPbkc85s
"I Tested Meta's Ray-Ban Display Glasses","Mrwhosetheboss",11m 17s,https://www.youtube.com/watch?v=NTKC-LExZlI
"С КАМЕРУНКАМИ В ДЖАКУЗИ / адовая ночная жизнь Африки / ДУАЛА","ПЛАНЕТКА",31m 55s,https://www.youtube.com/watch?v=h_uM---ljxo
