Title,Channel,Duration,URL
"КАРАКАС -  самый ""опасный"" город мира/ВЕНЕСУЭЛА/ разыграли местную девушку в орлянку","ПЛАНЕТКА",46m 41s,https://www.youtube.com/watch?v=-pYz9IE1Uns
"Is pulling out an effective way to prevent pregnancy? Is precum safe?!","Rena Malik, M.D.",3m 17s,https://www.youtube.com/watch?v=qOwdupIlQDM&pp=ugUEEgJlbg%3D%3D
"The Best Bossa Nova Cover 2025 🍒🎧Relax & Unwind Jazz in Summer Mood [ 𝒓𝒆𝒍𝒂𝒙 𝒔𝒖𝒎𝒎𝒆𝒓 𝒋𝒂𝒛𝒛 ]","𝗽𝗮𝗹𝗺 𝗽𝗮𝗹𝗺 𝘁𝘂𝗻𝗲𝘀",3h 11m 58s,https://www.youtube.com/watch?v=6hgFZSM8IRM&list=RD6hgFZSM8IRM&start_radio=1&t=3524s&pp=oAcB
"3,890,000 THB ($113,000) Brand New Apartment in Chiang Mai, Thailand","Farang Homes",17m 37s,https://www.youtube.com/watch?v=cg6mWuIthto&pp=0gcJCcoJAYcqIYzv
"Japanese Women or Singaporean Women? You’ll Be Shocked Who Wins","Professor Nam",16m 24s,https://www.youtube.com/watch?v=Wf6acPNt4EE&pp=0gcJCcoJAYcqIYzv
"🇵🇭 ФИЛИППИНЫ / украли ДЕНЬГИ в первый же день / ТРАНСЫ хватают за ... 🇵🇭","АНАНАСИК",16m 50s,https://www.youtube.com/watch?v=lCzk32AP1wY
"Yiddish Song From the Shtetl","Olga Avigail",2m 44s,https://www.youtube.com/watch?v=M3CjnabPQyg&list=RDM3CjnabPQyg&start_radio=1
"Что было до БОЛЬШОГО ВЗРЫВА? Астрофизик Асташенок про тайны МУЛЬТИВСЕЛЕННОЙ.","Глеб Соломин",55m 43s,https://www.youtube.com/watch?v=TjVQvhEA_JE&pp=ugUEEgJydQ%3D%3D
"This app made over $1M","Starter Story",15m 16s,https://www.youtube.com/watch?v=VfNRd5Rk0cM&pp=ugUHEgVlbi1VUw%3D%3D
"Sabah floods: 2,897 victims sheltering at relief centres","KiniTV",6m 46s,https://www.youtube.com/watch?v=-iWNeXQxqQI
"Poachers nabbed with dead tiger in car","NST Online",1m 2s,https://www.youtube.com/watch?v=qr44EJ7cIGU&pp=0gcJCcoJAYcqIYzv
"Israel won't strike Qatar again, urges US","The Star",2m 51s,https://www.youtube.com/watch?v=9cUtYWhK3pI
"Sabah death toll climbs to 13","The Sun Malaysia",39s,https://www.youtube.com/watch?v=DWeoD0CIsY0
"Zii Jia forced to retire in China Masters opener","NST Online",43s,https://www.youtube.com/watch?v=b7ND_Ulmodo
"World champs Tang Jie-Ee Wei off to winning start in Shenzhen","NST Online",37s,https://www.youtube.com/watch?v=BzW_XHZwXXU
"Malaysia Day 2025 grand finale in Penang a spectacle of unity and patriotism","The Star",2m 52s,https://www.youtube.com/watch?v=IaXubylipg4
"PAS delegates unanimously approve resolution to lead PN in GE16","Free Malaysia Today",1m 28s,https://www.youtube.com/watch?v=fVLfRVXrWN8
"Cops confirm probe into UM student group president","Free Malaysia Today",1m 25s,https://www.youtube.com/watch?v=a4erIXkWT2k
"Rosmah fails in appeal to recuse judge in solar project trial","The Sun Malaysia",1m 10s,https://www.youtube.com/watch?v=cmR7s-rFSZc&pp=0gcJCcoJAYcqIYzv
"Mother, son among eight arrested in MACC's Op Rentas","NST Online",1m 6s,https://www.youtube.com/watch?v=9XSrqB6lkxQ
"PM: Malaysia to continue driving economic growth without neglecting human values","The Star",3m 56s,https://www.youtube.com/watch?v=0s2brw_AypM&pp=0gcJCcoJAYcqIYzv
"What is An Attractive Man? Ireland 1967","CR's Video Vaults",3m 7s,https://www.youtube.com/watch?v=LvGgYcpSi8U
"УЛАН-БАТОР столица Монголии. Такого мы ещё не видели. Все достопримечательности. Цены в Монголии","Dream Way",1h 27m 36s,https://www.youtube.com/watch?v=3Lcp7GbW32A
"How to rank ANY Website #1 in 2025 (HACKS INSIDE) - BIP639","Jacky Chou from Indexsy",9m 50s,https://www.youtube.com/watch?v=3u6Qg3VPr1c&pp=ugUEEgJlbg%3D%3D
"Charlie Kirk Gets a College Student to Admit THE TRUTH on Immigration","Charlie Kirk",14m 51s,https://www.youtube.com/watch?v=5YAyoE-8PC4
"All or Nothing at All","Frank Sinatra - Topic",4m,https://www.youtube.com/watch?v=IAN_jLnD_Q8&list=RDIAN_jLnD_Q8&start_radio=1
"Singapore PM's UNUSUAL Warning To Islamists; 'Won't Tolerate, Our Country...' | Singapore Election","Times Of India",7m 8s,https://www.youtube.com/watch?v=c628UgLVXBc
"The Barrens - Music & Ambience | World of Warcraft Classic","Meisio",2h 20s,https://www.youtube.com/watch?v=KyHl1YQH7xI&list=RDKyHl1YQH7xI&start_radio=1&pp=oAcB
"ChatGPT Tutorial: 35 Tips I Wish I Knew Sooner","Matt Wolfe",38m 59s,https://www.youtube.com/watch?v=WTF5qphyy8w&pp=ugUEEgJlbg%3D%3D
"Bossa Nova Covers Of Popular Songs 100 Hits - Bossa Nova 2025","Bossa Nova Songs",3h 3m 16s,https://www.youtube.com/watch?v=JP9EU2FuLFM&list=RDJP9EU2FuLFM&start_radio=1&pp=oAcB
"Впервые в Сеуле! Сравниваю с Японией 🇯🇵 vs 🇰🇷 Культурный шок, кафе, корейская еда","ToriChyanChannel",23m 50s,https://www.youtube.com/watch?v=pn8lbS-QFts
"Казахстанка покорила Японию инновацией в стоматологии","Телеканал 24kz",2m 16s,https://www.youtube.com/watch?v=82u_DKgecUY
"White Rabbit | Matrix Resurrections (Extended Remix)","Breakfast In Backstage",3m 41s,https://www.youtube.com/watch?v=Nk4gNDPgv_c&list=RDNk4gNDPgv_c&start_radio=1
"Herniated Disc, Bulging Disc, Paralysis | Lower Back Pain","Core Balance Training",7m 19s,https://www.youtube.com/watch?v=kpVGIvL-PLQ&pp=ugUEEgJlbg%3D%3D
"I was a North Korean Spy: Training in Seduction and Espionage Tactics","DimpleVideo",14m 56s,https://www.youtube.com/watch?v=CIV6Yv6OWGM
"Buy Gold in Thailand 2025: Practical Tips For First Time Gold Buyers Living in Thailand","Made it in Thailand w/ Scott Pressimone",7m 35s,https://www.youtube.com/watch?v=FRekeV8luNY
"WATCH: Charlie Kirk’s alleged killer makes first court appearance","Sky News Australia",11m 16s,https://www.youtube.com/watch?v=i2BZSJc8Y2M
"Grace Jones - I've Seen That Face Before (Libertango)","GraceJonesVEVO",4m 50s,https://www.youtube.com/watch?v=nIN3IE3DHqc&list=RDGMEMYH9CUrFO7CfLJpaD7UR85wVMnIN3IE3DHqc&start_radio=1
"How I Got My American Accent","Rodica - The Foreign Sun",24m 57s,https://www.youtube.com/watch?v=Exc7nqVF9pU
"Наполеона отравили? Жозефина, «100 дней», ссылка. 15 простых вопросов историку / Борис Кипнис","Цифровая история",1h 41m 24s,https://www.youtube.com/watch?v=vf_xrW2LFEk&pp=0gcJCcoJAYcqIYzv
"Why is Korea the plastic surgery Capital of the World?","Retired Working For You",14m 56s,https://www.youtube.com/watch?v=jO4OA0p7960
"When Should You Say You Have A Boyfriend?","BuzzFeedViolet",2m 34s,https://www.youtube.com/watch?v=z5DyFpXmRis
"Why so many famous Berlin clubs are closing | DW News","DW News",5m 28s,https://www.youtube.com/watch?v=WiXHj2nYy1o
"🇲🇾 RAW Opinions Of Foreign Travelers  ⚠️ No Holding Back - Malaysia 2025","Chai Travel",15m 11s,https://www.youtube.com/watch?v=mdxim7L23iA&pp=ugUEEgJlbg%3D%3D
"Actual Nazi Struggling To Stand Out Now That Everyone's A Nazi","The Babylon Bee",3m 28s,https://www.youtube.com/watch?v=A8UwMCeD6jU
"The Trio Visit Hogsmeade | Half-Blood Prince","Harry Potter",6m 26s,https://www.youtube.com/watch?v=hfhrHLxrhGk
"[스타크래프트 라이브 콘서트] 테란 음악 앵콜 영상","스타크래프트",5m 39s,https://www.youtube.com/watch?v=plme_oDCpHc&list=RDplme_oDCpHc&start_radio=1&pp=oAcB
"Local SEO in 2025: What Actually Works (w/ Joy Hawkins)","Edward Sturm",1h 5m 41s,https://www.youtube.com/watch?v=pZ9HZu4qFWY
"5 Signs the AI Bubble is Bursting","Sabine Hossenfelder",6m 41s,https://www.youtube.com/watch?v=_L1JbzDnEMk
"I Retired At 39 And Live On $185K A Year In Dubai","CNBC Make It",9m 11s,https://www.youtube.com/watch?v=L-9BYcc6--A
"KYOTO Summer 1980 🌸 Nostalgia City Pop Playlist | 夏のシティポップBGM","Hazy Streets",1h 59m 45s,https://www.youtube.com/watch?v=BVDWRnSK0M0&list=RDBVDWRnSK0M0&start_radio=1&pp=oAcB
"Ladyboy Chinni’s First Time in Europe 🇩🇪","Roman & Chinni",28m 12s,https://www.youtube.com/watch?v=h82EOIfqr-A&t=35s&pp=ugUEEgJlbg%3D%3D
"ДРОБЫШЕВСКИЙ-СПОР О РЕЛИГИИ И МАГИИ!!!!!!","Drobyshevsky",9m 12s,https://www.youtube.com/watch?v=ExqCOQxBlGk&pp=ugUEEgJydQ%3D%3D
"Is KUALA LUMPUR the Most Underrated City in Southeast Asia? Our Honest First Impressions","Wind Kissed Horizons",28m 58s,https://www.youtube.com/watch?v=xUBxTQIvFMo
"What We Just Found on Mars","StarTalk",10m 53s,https://www.youtube.com/watch?v=kvcfO_-p6YE&pp=ugUEEgJlbg%3D%3D
"The REAL Reason You’re Aging FAST After 40 (Science backed fix)","Seth Capehart MD",6m 58s,https://www.youtube.com/watch?v=om4LeyF_9JE
"I Remade Star Wars VFX in 1 Week","ErikDoesVFX",10m 39s,https://www.youtube.com/watch?v=oSOQpnWlYU4
"Нельзя взрослеть!! Идеал красоты в Китае","SHANKANAKA",14m 38s,https://www.youtube.com/watch?v=LRj54JLZl5U
"Merry Christmas Mr. Lawrence - From Ryuichi Sakamoto: Playing the Piano 2022","Ryuichi Sakamoto",5m 53s,https://www.youtube.com/watch?v=ELJf83TelA0&list=RDELJf83TelA0&start_radio=1&pp=oAcB0gcJCcoJAYcqIYzv
"How sexual selection works in evolution | Dave Hone and Lex Fridman","Lex Clips",9m 4s,https://www.youtube.com/watch?v=Sy8DooSNIf8&pp=0gcJCcoJAYcqIYzv
"Владимир Молчанов. Разговоры в пивной. До и после полуночи (1991)","Советский юмор",6m 49s,https://www.youtube.com/watch?v=QHyo0YuBuhc
"21 Savage - redrum (Official Audio)","21SavageVEVO",4m 33s,https://www.youtube.com/watch?v=ukbiRcyzrpc&list=RDukbiRcyzrpc&start_radio=1&pp=oAcB
"1940's Vintage Swing Jazz -  Smooth Jazz Relaxing Music for Focus","barely jazz",3h 1m 55s,https://www.youtube.com/watch?v=q9OAoyoTAYY&list=RDq9OAoyoTAYY&start_radio=1&pp=oAcB
"I Am Salahudin | Kingdom of Heaven Powerful Scene","Legends and Legacy",4m 44s,https://www.youtube.com/watch?v=tgFcTX-ciZM
"Comedy Club: Борьба с тарелочницами | Екатерина Шкуро, Никита Никитин @ComedyClubRussia","Comedy Club",8m 49s,https://www.youtube.com/watch?v=aPdEzyf8Kk0
"China showcases advanced humanoid robots at 2025 World Robot Conference in Beijing","Al Jazeera English",2m 44s,https://www.youtube.com/watch?v=51VI8DZGGag
"Charlie Kirk vs. Feminist: Are We Still Living in a Patriarchy? 😳","Turning Point USA",15m 37s,https://www.youtube.com/watch?v=HRZRqL-Xgs4
"Sentry Destroys The Team Scene | THUNDERBOLTS* (2025) Movie CLIP HD","JoBlo Movie Clips",5m 22s,https://www.youtube.com/watch?v=zPqdK0E7nvA
"Шаббатная песня - Шалом алейхем (Израиль)","Azraq V",4m 21s,https://www.youtube.com/watch?v=hT5CexIBDyA&list=RDhT5CexIBDyA&start_radio=1
"Переезд в США 2025. Часто жалею о переезде. Ответы на вопросы.","#PROsto Ludi",29m 19s,https://www.youtube.com/watch?v=mmczjxoVlwA
"Selling The iPhone 15 For $15..","BigDawsTv",12m 7s,https://www.youtube.com/watch?v=817otOU_5Lw
"Prometheus/Alien - Deleted Engineer Dialogues: What Was Left Behind the Scenes","Gaze4You",15m 48s,https://www.youtube.com/watch?v=BF_x3QueXSw
"EAZY-E - Real Muthaphuckkin' G's (EXPLICIT VERSION)","MKPr0ducti0nsHipHop",5m 24s,https://www.youtube.com/watch?v=U5yFoeAaG8Q&list=RDU5yFoeAaG8Q&start_radio=1&pp=oAcB
"Why Men Get So Few Matches on Dating Apps","Memeable Data",9m 27s,https://www.youtube.com/watch?v=x3lypVnJ0HM
"Не начинай ГОЛОДАНИЕ пока не посмотришь этот ролик // #тибетскаямедицина #докторжимба","Доктор Жимба (Чжуд-Ши клиника)",15m 33s,https://www.youtube.com/watch?v=9vP_d2yHQKI
"БРОСИЛИ НА ОСТРОВЕ! НЕВЕРОЯТНАЯ ЖИЗНЬ ФЁДОРА ТОЛСТОГО","Владимир Чайкин",46m 55s,https://www.youtube.com/watch?v=cnK9-hLFCB8
"ПУГАЧЕВА ТАК И НЕ ВСТАЛА ПЕРЕД ПУТИНЫМ НА КОЛЕНИ  @BelkovskiyS #набело #белковский","Белковский",49m 50s,https://www.youtube.com/watch?v=INRg0bxjQGE
"揽佬SKAI ISYOURGOD-《大展鸿图》ft.AR刘夫阳 Official Music Video","揽佬SKAI ISYOURGOD",3m 30s,https://www.youtube.com/watch?v=mldcDidGJCg&list=RDmldcDidGJCg&start_radio=1
"UNTHINKABLE: Charlie Kirk, 31, Assassinated","Ben Shapiro",54m 7s,https://www.youtube.com/watch?v=2X7FMBpg7fs&pp=ugUEEgJlbg%3D%3D
"advise tips and tutorial on CLIPSHIFT, IN DEPTH GUIDE WITH live and street performance","Magic Axs",9m 24s,https://www.youtube.com/watch?v=RDaM4H1bbog
"Шагающие машины ВНИИ Трансмаш (шагающий движитель). 1980 г.","Andrei",9m 40s,https://www.youtube.com/watch?v=hQSO-6LvINQ
"5 Scams that will ruin your trip to VIETNAM","Travis Travels Vietnam",8m 4s,https://www.youtube.com/watch?v=etET7VV1NPw&pp=ugUHEgVlbi1VU9IHCQnKCQGHKiGM7w%3D%3D
"YTCracker - Bazaar","Nicholas Rake",2m 55s,https://www.youtube.com/watch?v=X6t3CVafuec&list=RDMMX6t3CVafuec&start_radio=1
"StarCraft 1 Terran Theme Compilation | StarCraft + StarCraft: Brood War OST","VGM Realm",26m 9s,https://www.youtube.com/watch?v=7mCUoUaQsLE&list=RD7mCUoUaQsLE&start_radio=1&pp=oAcB
"Born in Japan, but Too Tall for Everything","Oriental Pearl",16m 53s,https://www.youtube.com/watch?v=koBxBzgb_ns
"Machiavelli's Hacks to Control Any Woman (Dark Psychology)","Eclipsophy",22m 40s,https://www.youtube.com/watch?v=YCR-r0D5_JE
"Что такое WARCRAFT 3 - ЛЕГЕНДАРНЫЙ СЮЖЕТ","KK3852",1h 25s,https://www.youtube.com/watch?v=wR4qaTs58oE
"Every Paid AI - Now FREE & UNLIMITED (100% Legal)","Malva AI",10m 16s,https://www.youtube.com/watch?v=EwBfI0LUNBU&pp=ugUEEgJlbg%3D%3D
"Минусы iPhone Air и фишки iPhone 17 Pro — какой взять?","Rozetked",19m 2s,https://www.youtube.com/watch?v=RNMwVEs3AKI&pp=ugUEEgJydQ%3D%3D
"Эдуард Артемьев | Лучшие электронные композиции (СБОРНИК) | Часть 1 @artemiev","Эдуард Артемьев",32m 24s,https://www.youtube.com/watch?v=E8YCQ0zjCZA&list=RDE8YCQ0zjCZA&start_radio=1&pp=oAcB
"Женский стендап 3 сезон - Мейханаджян, Белла, Джабраилова, Муратова, Аранова, Щербакова и другие","Comedy Woman. Первые сезоны",45m 44s,https://www.youtube.com/watch?v=9svZQdwQIeM
"ТОП 20 хитростей для комфортного перелёта! Как пережить длительный перелет и справиться с джетлагом?","Дмитрий Карманов | Dallure Travel ",19m 58s,https://www.youtube.com/watch?v=cLVBbIOgyP8
"Demis Hassabis: The CEO Working to Solve Cancer With AI","Bloomberg Technology",8m 51s,https://www.youtube.com/watch?v=sDZ1j0J-fe8
"Fox News Highlights - September 16th, 2025","Fox News",19m 53s,https://www.youtube.com/watch?v=n5M-uMSHZHI
"Chinese Girls' True Opinions on Splitting the Bill on Dates","Ninjenny Land",6m 46s,https://www.youtube.com/watch?v=w1AcETE7Ofo
"Thai Massage Words Every Expat Should Know","Thai For Beginners",5m 5s,https://www.youtube.com/watch?v=ju7NBnxcukk
"Carmina Burana ~ O Fortuna | Carl Orff ~ André Rieu","ingifrance",5m 13s,https://www.youtube.com/watch?v=GD3VsesSBsw&list=RDGD3VsesSBsw&start_radio=1&pp=oAcB
"Почему корейцам сложно учить русский язык? | HANI","HANI [하니]",8m 20s,https://www.youtube.com/watch?v=ogYIwWlVI5w
"pov: you come back to your childhood (relaxing zelda music & rain)","Sleepy Frisk",6h 43m 31s,https://www.youtube.com/watch?v=7W2PCPDrULM&list=RD7W2PCPDrULM&start_radio=1&pp=oAcB
"War and Peace, Part Two | BASED ON LEO TOLSTOY NOVEL | FULL MOVIE","Mosfilm",1h 37m 36s,https://www.youtube.com/watch?v=uJjqSfdFuUI
"I Went Viral on YouTube Shorts to Prove It's Not Luck","Jack Craig",8m 1s,https://www.youtube.com/watch?v=6fydRj2ZT9s
"macOS 26 Tahoe is Out! - What's New?","zollotech",24m 52s,https://www.youtube.com/watch?v=rRcL45PDFPg
"Thailand Elite Visa (Privilege Card): Worth it in 2025?","Jett Gunther",7m 54s,https://www.youtube.com/watch?v=lblhN-1RfAA&pp=ugUHEgVlbi1VUw%3D%3D
"Жириновский ещё в 2006 о судьбе Украины","ЛДПР",19m 11s,https://www.youtube.com/watch?v=M6sdAhjIiQI
"Meta Celeste (Hypernova) AR Glasses & New Ray-Bans Expected Soon!","TechAvid",8m 3s,https://www.youtube.com/watch?v=0_zzNj7JTrA&pp=ugUEEgJlbg%3D%3D
"ARCADIA - EL DIABLO (Lyrics)","Shummer Channel",6m 2s,https://www.youtube.com/watch?v=wuCJnwaXkNo&list=RDGMEM6CZm14o9sc-Q22TIneLI8gVMwuCJnwaXkNo&start_radio=1
"Дофамин. Как научиться управлять своими желаниями? Стань успешным без усилий.","Александр Дзидзария",23m 24s,https://www.youtube.com/watch?v=dSdCV5vKfYw&pp=0gcJCcoJAYcqIYzv
"Why Am I Always Unhappy: It Took Me 40 Years to Figure Out","LazyCabbie",15m 53s,https://www.youtube.com/watch?v=k7PV_Mb2_6U&pp=ugUEEgJlbg%3D%3D
"Tips on Attracting a Japanese Woman","Dating Beyond Borders",8m 14s,https://www.youtube.com/watch?v=6_oMAqPIEhM
"Elon Musk on DOGE, Optimus, Starlink Smartphones, Evolving with AI, Why the West is Imploding","All-In Podcast",44m 48s,https://www.youtube.com/watch?v=qeZqZBRA-6Q
"This walk with Brit in Bangkok changed my view of Thailand","Max Chernov",22m 35s,https://www.youtube.com/watch?v=4oN3PUzkwTM
"Как 80 родственников Кадырова будут делить Чечню после его смерти? | Би-би-си объясняет","BBC News - Русская служба",20m 7s,https://www.youtube.com/watch?v=72uwDFASn4U
"THIS Is #1 FASTEST Way To Attract Beautiful Women","The Diary Of A CEO Clips",22m 47s,https://www.youtube.com/watch?v=CdMtxDHT0DI&pp=ugUEEgJlbg%3D%3D
"I got EVO ICL Eye Surgery - Here's What Happened","Doctor Eye Health",13m 32s,https://www.youtube.com/watch?v=ZXheY9-62yU
"ГОРОД ГРЕХА ГАМБУРГ: и чем немцы лучше русских??","ПЛАНЕТКА",21m 24s,https://www.youtube.com/watch?v=57Tl_LT1Ifg
"3,899,000 THB ($120,000) Villa for Sale in Hua Hin, Thailand","Farang Homes",8m 20s,https://www.youtube.com/watch?v=XFtLUOU_R4o&pp=ugUHEgVlbi1VUw%3D%3D
"How To Make Popular Paid Apps For FREE","Matt Wolfe",19m 36s,https://www.youtube.com/watch?v=I-m4HSjptAM&pp=ugUEEgJlbg%3D%3D
"I made over $10k spamming Reddit…here’s my SOP - BIP635","Jacky Chou from Indexsy",11m 26s,https://www.youtube.com/watch?v=N89ERI6WXgE&pp=ugUEEgJlbg%3D%3D
"Rivkele - Rebeka Yiddish Tango","Olga Avigail",5m 20s,https://www.youtube.com/watch?v=ENSFSYqqfOk&list=RDENSFSYqqfOk&start_radio=1&pp=oAcB
"ВАРАДЕРО: рай оказался полным отстоем! КУБА, ГАВАНА","ПЛАНЕТКА",52m 11s,https://www.youtube.com/watch?v=gdC26CenTs0
"3,900,000 THB ($113,000) Pre-Sale Condo in Pattaya, Thailand","Farang Homes",15m 16s,https://www.youtube.com/watch?v=acD4OcFNczw
"Masked ""Cracker"" Almost Passes Out When Exposed For Radical Racism","Charlie Kirk",12m 42s,https://www.youtube.com/watch?v=WpiDnlPlErs&pp=ugUHEgVlbi1VU9IHCQnKCQGHKiGM7w%3D%3D
"Google’s War on Scaled AI Content: The Rise and Fall of AInvest","Edward Sturm",13m 56s,https://www.youtube.com/watch?v=RpgOKUO_SyI&pp=ugUEEgJlbg%3D%3D
"THE HISTORY OF THAILAND in 10 minutes","Knowledgia",10m 44s,https://www.youtube.com/watch?v=zo1e7XUWkME&pp=ugUEEgJlbg%3D%3D
"МАНИЛА: жизнь и секс на кладбище / город сотни тысяч бомжей /PHILIPPINES MANILA","ПЛАНЕТКА",38m 36s,https://www.youtube.com/watch?v=ta9LudNg69A
"Can you take Sildenafil or Tadalafil just “for fun?”! | ED Medications","Rena Malik, M.D.",10m 28s,https://www.youtube.com/watch?v=9215PU26cdw
"Charlie Kirk Expertly Debates Why Israel CAN'T Live Under Muslim Rule","Charlie Kirk",15m 53s,https://www.youtube.com/watch?v=GoFsc62V2Qo
"Thailand Digital Arrival Card (TDAC) 2025 – Complete Step-by-Step Guide","The Nomadic Journey",7m 14s,https://www.youtube.com/watch?v=UCMKjUwbvew&pp=ugUEEgJlbg%3D%3D
"Charlie Kirk can't be accused of hate speech, 'they just hated his speech': Pastor Rob McCoy","Fox News",4m 34s,https://www.youtube.com/watch?v=kSxBQEz5e2w
"СЕВЕРНЫЙ КИПР: смотрим квартиру за 200 000 евро!! / 2 серия","ПЛАНЕТКА",18m 10s,https://www.youtube.com/watch?v=FeOc6VP5Qik
"Feralas - Original Wow Music","Wowmusicable",3m 57s,https://www.youtube.com/watch?v=SXImOlFUGYo&list=RDSXImOlFUGYo&start_radio=1&pp=oAcB
"The Best Gun Debate I've Had in Years","Charlie Kirk",12m 3s,https://www.youtube.com/watch?v=n-X0YD0tYTw&pp=ugUHEgVlbi1VUw%3D%3D
"No Plural Words in Thai? What Expats Need to Know","Thai For Beginners",4m 50s,https://www.youtube.com/watch?v=7ghagJHVJFM&pp=0gcJCcoJAYcqIYzv
"You WON’T KNOW Until You GO! Dating Asian Girls","Asian Women Official",10m 2s,https://www.youtube.com/watch?v=vLwjlMkhG_o
"ГАВАНА / ""Хочешь снять мою жену?"" / Что можно купить в кубинском магазине / КУБА 3 СЕРИЯ","ПЛАНЕТКА",40m 9s,https://www.youtube.com/watch?v=2Gy3TTZatdQ
"More Extraordinary Card Magic of Jason Ladanye: Catch Me if You Can","CardMagicByJason",6m 43s,https://www.youtube.com/watch?v=_Wbw5UfTeNg
"Mortal Kombat Syndrome (Edit)","Kutluhan Tekin",5m 1s,https://www.youtube.com/watch?v=IjhC5oH4rmI&list=RDIjhC5oH4rmI&start_radio=1
"Kendrick Lamar - Money Trees ft. Jay Rock [good kid, m.A.A.d city]","Will McBride",6m 28s,https://www.youtube.com/watch?v=omddYFfk9Ng&list=RDomddYFfk9Ng&start_radio=1&pp=oAcB
"Foreigner DELETES Apps to Date REAL Chinese Girls","Asian Women Official",7m 34s,https://www.youtube.com/watch?v=POgOuJGwZ_E
"""ЦЕЙЛОН НАШ!"" - очереди в алкомаркет, российские флаги, Шри-Ланка превратилась в Анапу","ПЛАНЕТКА",30m 50s,https://www.youtube.com/watch?v=U5og42s8990
"Gogol Bordello - Baro Foro (Live From Axis Mundi)","SideOneDummy",16m 3s,https://www.youtube.com/watch?v=IszwCA6vFMU&list=RDIszwCA6vFMU&start_radio=1&pp=oAcB
"The ONE Question at Oxford That Charlie Kirk Didn’t See Coming… 🔥","Turning Point USA",3m 59s,https://www.youtube.com/watch?v=bgnWcTIr050
"Entity SEO, Parasite Hacks & Google Patches - with Jesper Nissen","Edward Sturm",1h 29m 2s,https://www.youtube.com/watch?v=Z_ASSaa1bxQ
"The M4 MacBook Air Has Caused an Identity Crisis...","SPACE DESIGN WAREHOUSE",14m 1s,https://www.youtube.com/watch?v=uFqfinPwAvA&pp=ugUHEgVlbi1VUw%3D%3D
"НА УТРО КРАСОТКА ПРЕВРАТИЛАСЬ В ... / как кадрятся кубинки и чем это может обернуться","ПЛАНЕТКА",20m 55s,https://www.youtube.com/watch?v=RAJxtl3GBYU
"Madonna - Hung Up (Official Video) [HD]","Madonna",5m 34s,https://www.youtube.com/watch?v=EDwb9jOVRtU&list=RDEDwb9jOVRtU&start_radio=1&pp=oAcB
"A$AP Rocky - Praise The Lord (Da Shine) (Official Video) ft. Skepta","LIVELOVEASAPVEVO",3m 47s,https://www.youtube.com/watch?v=Kbj2Zss-5GY&list=RDKbj2Zss-5GY&start_radio=1&pp=oAcB
"Vietnam E-Visa Guide 2025:  Approved on Your First Try","Travis Travels Vietnam",10m 30s,https://www.youtube.com/watch?v=_z_vJq2L_rQ&pp=ugUHEgVlbi1VUw%3D%3D
"СКОЛЬКО СТОИТ ВЕЧЕР С ЯПОНКОЙ? / Их нижнее белье, бицепсы и другие извращения / TOKYO 2024","ПЛАНЕТКА",41m 27s,https://www.youtube.com/watch?v=rdLYE_NPMw8&t=1604s&pp=0gcJCcoJAYcqIYzv
"10 Ways to Use NotebookLM’s Insane New FREE Features","Blazing Zebra",13m 3s,https://www.youtube.com/watch?v=fvCYqh7qcmg&pp=ugUEEgJlbg%3D%3D
"TERROR NETWORK? More Suspects May Be Coming in Kirk Assassination…","Ben Shapiro",51m 56s,https://www.youtube.com/watch?v=R0uA5A9EehA&list=PLX_rhFRRlAG58_4z9KWPUYrnTM6QZDJrT&pp=0gcJCaIEOCosWNin
"Bali Airport Arrival Guide 2025 - How to Get Through Immigration, Visa and Transport","The Nomadic Journey",8m 56s,https://www.youtube.com/watch?v=apAq188bHII
"Дрон и снайпер: политическое насилие в Европе и США","Екатерина Шульман",14m 1s,https://www.youtube.com/watch?v=gJPeTmpJi14&pp=ugUEEgJydQ%3D%3D
"Boy Kavalier and Yutani's Tense Negotiation - Scene | Alien: Earth | FX","FX Networks",5m 7s,https://www.youtube.com/watch?v=jMcaB1DZjbQ
"Travis Scott - SICKO MODE ft. Drake","TravisScottVEVO",5m 23s,https://www.youtube.com/watch?v=6ONRf7h3Mdk&list=RD6ONRf7h3Mdk&start_radio=1&pp=oAcB0gcJCcoJAYcqIYzv
"You Know You're Dating a Chinese Woman When...","Dating Beyond Borders",5m 20s,https://www.youtube.com/watch?v=J9K2VfzwqqA
"How Singapore Built a Stable Society","Bloomberg Originals",12m 53s,https://www.youtube.com/watch?v=XwMnLpfSpgw
"AirPods Pro 3 Review: I Understand It Now!","Marques Brownlee",11m 50s,https://www.youtube.com/watch?v=GB0b6KFZVq0&pp=ugUEEgJydQ%3D%3D
"Alien: Earth Cast Q&A with Babou Ceesay and Samuel Blenkin | FX","FX Networks",5m 14s,https://www.youtube.com/watch?v=uM66Bb467nk
"21 SAVAGE - LEGACY II 21 Minutes Best of 21 Savage Music","Millionaire",18m 12s,https://www.youtube.com/watch?v=spwU1Xh3p3Y&list=RDspwU1Xh3p3Y&start_radio=1&pp=oAcB
"Раствор коварен","Александр Горелов",5m 3s,https://www.youtube.com/watch?v=JkrBqVKcIlU
"Google убивает профессию фотографа? Обзор нейронки Nano Banana","Александр Макушин",7m 27s,https://www.youtube.com/watch?v=TiVUE7vPiMk
"iOS 26: 26 New Features for Apple’s New iPhone Software Update | WSJ","The Wall Street Journal",9m 3s,https://www.youtube.com/watch?v=cbD2LWnDCIc
"Why the US & China both Need Indonesia","Aaron Watson ",17m 11s,https://www.youtube.com/watch?v=Vvck2e-I4LY
"China’s Vanishing Muslims: Undercover In The Most Dystopian Place In The World","VICE News",31m 48s,https://www.youtube.com/watch?v=v7AYyUqrMuQ
